username;date;retweets;favorites;text;geo;mentions;hashtags;id;permalink
hrksrkr;2020-07-15 16:02;3;12;"This talk is gonna start in 20 min ET @ HiTSeq # ISMB2020 , here is the Terminus algorithm in action, collapsing transcripts, from the equivalence class graph. https://twitter.com/nomad421/status/1283395912568643586 …pic.twitter.com/omSF5LpIfY";;@;#;"1283492138282622976";https://twitter.com/hrksrkr/status/1283492138282622976
mlaval6;2020-07-15 15:58;10;33;"Congratulations to @ IrynaAb who won the best poster award in @ iRnaCosi at # ISMB2020 Work in collaboration with @ rnp_biology @ ircm_mtl Fantastic work Iryna!!! @ iscb @ uOttawaTMM # Bioinformaticspic.twitter.com/0fwiN0sJo2";;@ @ @ @ @ @;# #;"1283491091371696132";https://twitter.com/mlaval6/status/1283491091371696132
ISCB_RegSys;2020-07-15 15:55;4;6;"How to detect loops in Hi-C data? Abbas Ardakany from @ ferhatay lab tells # RegSys2020 how Mustache https://www.biorxiv.org/content/10.1101/2020.02.24.963579v1 … uses progressive gaussian filtering to find more (& more reproducible) loops than other methods, connecting more enh/prom # ISMB2020";;@;# #;"1283490464159727616";https://twitter.com/ISCB_RegSys/status/1283490464159727616
antoniyaaleks;2020-07-15 15:48;0;2;"Thank you, Arun! So glad you enjoyed it. The programme is full of exciting research # ISMB2020 # 3dsig";;;# #;"1283488534989398016";https://twitter.com/antoniyaaleks/status/1283488534989398016
mahonylab;2020-07-15 15:47;0;5;"Abbas Ardakany from @ ferhatay 's group: Mustache: Multi-scale Detection of Chromatin Loops from Hi-C and Micro-C Maps using Scale-Space Representation # RegSys2020 # ISMB2020. Progressive Gaussian filtering of Hi-C contact maps - neat approach!";;@;# #;"1283488312393715715";https://twitter.com/mahonylab/status/1283488312393715715
ycuestaastroz;2020-07-15 15:46;0;0;"Dónde? # ISMB2020 ?";;;#;"1283488152146055169";https://twitter.com/ycuestaastroz/status/1283488152146055169
arunprasad_p;2020-07-15 15:44;1;4;"Interesting talk on Deep Learning of Protein Structural Classes by @ EliDraizen from @ pebourne lab @ 3dsig @ iscb. Thank you! # ISMB2020";;@ @ @ @;#;"1283487659000827904";https://twitter.com/arunprasad_p/status/1283487659000827904
diaorch;2020-07-15 15:44;0;1;"Day 3 # ISMB2020 Anastasia Baryshnikova @ abarysh on assembling & analyzing large phenotypic data of genetic variations, concluding "Data librarianship is essential." I often wonder how - it won't as long as data sanitization & annotations etc. are not valued as scientific efforts";;@;#;"1283487637064605697";https://twitter.com/diaorch/status/1283487637064605697
AedinCulhane;2020-07-15 15:41;1;9;"Inspired by FISH, GAM uses ultra thin slices to examine chromatin. GAM seems to identify chromatin regions with more complex interactions, in addition to pairwise contacts. Excellent talk from Christoph Thieme from MDC Berlin. # ISMB2020 pic.twitter.com/m0L4XSLt2f";;;#;"1283486804503662593";https://twitter.com/AedinCulhane/status/1283486804503662593
arunprasad_p;2020-07-15 15:33;2;2;"Excellent keynote from @ peng_illinois at @ 3dsig on Machine learning for structural and functional genomics. Congratulations to Jian for receiving the 2020 @ iscb Overton Prize! # ISMB2020";;@ @ @;#;"1283484933403615235";https://twitter.com/arunprasad_p/status/1283484933403615235
CamilleMrcht;2020-07-15 15:28;3;6;"# ISMB2020 # hitseq2020 @ krsahlin is presenting a self-correction method for RNA long reads based on clustering";;@;# #;"1283483547173564417";https://twitter.com/CamilleMrcht/status/1283483547173564417
mahonylab;2020-07-15 15:23;3;16;"Christoph Thieme from @ apombo1 lab: Comparison of chromatin contacts maps from GAM and Hi-C reveals method specific interactions linked with active and inactive chromatin # RegSys2020 # ISMB2020.";;@;# #;"1283482279919190019";https://twitter.com/mahonylab/status/1283482279919190019
arunprasad_p;2020-07-15 15:21;1;2;"Another nice talk on detecting symmetry in membrane proteins by @ antoniyaaleks from @ LucyRForrest lab @ 3dsig @ iscb. Thank you! See full programme @https://tinyurl.com/y9p873p3 # ISMB2020";;@ @ @ @ @https;#;"1283481842117738503";https://twitter.com/arunprasad_p/status/1283481842117738503
leechuck2;2020-07-15 15:18;1;12;"We had a great set of talks this morning at # bioont2020 # ISMB2020 about ontologies for # covid19 and textmining with ontologies and ontologies for # FAIR data and suicide notes. Also great keynote in the morning. Excited about the next set of talks!";;;# # # #;"1283480999943446531";https://twitter.com/leechuck2/status/1283480999943446531
arunprasad_p;2020-07-15 15:16;0;3;"Interesting talk by @ SluskyLab on Evolutionary pathways of repeat protein topology in bacterial outer membrane proteins @ 3dsig @ iscb. Thank you! See full programme @https://tinyurl.com/y9p873p3 # ISMB2020";;@ @ @ @https;#;"1283480649479880712";https://twitter.com/arunprasad_p/status/1283480649479880712
JeneaIA;2020-07-15 15:16;2;18;"Huge thanks to the # ISCB community for both an amazing conference program and the opportunity to share @ blkwomencompbio today at # ISMB2020.";;@;# #;"1283480465404559360";https://twitter.com/JeneaIA/status/1283480465404559360
AGKBorgwardt;2020-07-15 15:10;3;6;"How can antimicrobial resistance be predicted based on MALDI-TOF mass spectra? Find out in Caroline's # ISMB2020 presentation today at 17:00 EDT (23:00 CEST)! https://twitter.com/kmborgwardt/status/1282443589667225605 …";;;#;"1283479138372812801";https://twitter.com/AGKBorgwardt/status/1283479138372812801
jvarga92;2020-07-15 15:08;1;6;"Thanks to # ISMB2020, I just became aware of one of the most useful browser extension: https://gene-info.org/ By double-clicking on a gene name/id/uniprot/ensembl, etc. it gives you a pretty comprehensive overview of the whole protein with direct links to several databases!";;;#;"1283478452499357699";https://twitter.com/jvarga92/status/1283478452499357699
ISCB_RegSys;2020-07-15 15:06;0;1;"Head to Café Connect now to meet others from the # RegSys2020 COSI! # ISMB2020";;;# #;"1283478000684630016";https://twitter.com/ISCB_RegSys/status/1283478000684630016
luci_rmz;2020-07-15 15:04;0;4;"The second keynote from # RegSys2020 in # ISMB2020 was @ sara_mostafavi , who talked about immune differentiation using deep learning and data from the @ ImmGen_ project and how the model is actually learning meaningful and interpretable biological info";;@ @;# #;"1283477538426191873";https://twitter.com/luci_rmz/status/1283477538426191873
AedinCulhane;2020-07-15 15:03;1;11;"Excellent talk from Irene Kaplow at # ISMB2020 on predicting species and tissue-specific enhancers. Code for Halper that she mentiond is at https://github.com/pfenninglab/halLiftover-postprocessing … @ mahonylabpic.twitter.com/h6E0QIHxFw";;@;#;"1283477397782880264";https://twitter.com/AedinCulhane/status/1283477397782880264
Annhled6;2020-07-15 15:03;0;3;"Totally!! I've only left the channel for going to the Café Connect & then go back. All the talks have been very interesting & inspiring for someone new like me <3 # RegSys2020 # ISMB2020 pic.twitter.com/eDrXTOGgWy";;;# #;"1283477335434563586";https://twitter.com/Annhled6/status/1283477335434563586
ISCB_RegSys;2020-07-15 15:03;2;7;"Irene Kaplow from @ apfenning lab telling us how to train models for predicting enhancer activities across species - choice of negative sets is crucial, important to check enh from other tissues & those where activity not conserved https://academic.oup.com/bioinformatics/article-abstract/doi/10.1093/bioinformatics/btaa493/5837107?redirectedFrom=fulltext … # RegSys2020 # ISMB2020";;@;# #;"1283477333127692288";https://twitter.com/ISCB_RegSys/status/1283477333127692288
biovis_net;2020-07-15 15:03;1;5;"Wow! What a fabulous talk. Quick break before we're back with an absolutely fantastic set of 6 talks on spatial data at 3:20pm. @ MarwanAbdellah, Tobias Klein, Dimitar Garkov, @ thejiaqiwu, @ freiBaer, @ hsailem # ISMB2020 pic.twitter.com/bmfiXYMFyB";;@ @ @ @;#;"1283477180379394048";https://twitter.com/biovis_net/status/1283477180379394048
svheeringen;2020-07-15 15:00;0;5;"Really enjoying the # RegSys2020 session at # ISMB2020 so far. Great selection of talks!";;;# #;"1283476538944626690";https://twitter.com/svheeringen/status/1283476538944626690
jeffreyjgray;2020-07-15 14:57;0;3;"Jeff Ruffolo is sharing our antibody structure prediction deep learning work very soon! Join # ISMB2020 to watch the virtual talk. Team includes @ Jere_Sulam and Sai Pooja Mahajan, started with @ CarlosGuerrrra's @NSF_BIO @ RosettaCommons # REU project.https://twitter.com/jeffruffolo/status/1283472475439992833 …";;@ @ @NSF_BIO @;# #;"1283475778320191490";https://twitter.com/jeffreyjgray/status/1283475778320191490
WingKiCatherine;2020-07-15 14:51;0;1;"See the thread for a list of @ OPIGlets presenting at # ISMB2020! https://twitter.com/OPIGlets/status/1283035920531435521 …";;@;#;"1283474394321424384";https://twitter.com/WingKiCatherine/status/1283474394321424384
blkwomencompbio;2020-07-15 14:50;1;16;"Thank you to everyone who tuned into our # ISMB2020 Lunch and Learn--it's truly an honor to meet all of our new allies and members who are joining our community. Now's time to tune in to the rest of the amazing speakers";;;#;"1283474067711025152";https://twitter.com/blkwomencompbio/status/1283474067711025152
lgatt0;2020-07-15 14:48;1;8;"Ahh, # ISMB2020, why do you make me listen to myself. It's horrible https://twitter.com/lgatt0/status/1283413749228085248 …";;;#;"1283473493515014144";https://twitter.com/lgatt0/status/1283473493515014144
anaconesa;2020-07-15 14:47;2;13;"Enjoying the # ISMB2020 virtual conference so much!!! Do not miss the 3 pm @ HiTSeq session with very interesting transcriptomics and long reads talks, and the stellar participation of @ hagentilgner talking about Cell-type-specific isoform expression of coding and non-coding genes!";;@ @;#;"1283473247674269697";https://twitter.com/anaconesa/status/1283473247674269697
mahonylab;2020-07-15 14:45;2;7;"Now switching from predicting regulatory regions across cell types to predicting across species! Irene Kaplow from @ apfenning lab: A guide to predicting activity of enhancer orthologs in hundreds of species. # RegSys2020 # ISMB2020.";;@;# #;"1283472871159926785";https://twitter.com/mahonylab/status/1283472871159926785
beagj;2020-07-15 14:44;1;7;"Very interesting and enjoyable talk by @ AmyDWillis as # Microbiome keynote, with a comprehensive statistical analysis about the accuracy and bias of quantitative microbiome data. We should take care of conclusions based on relative abundances # ISMB2020 pic.twitter.com/f8Hb6EqQDD";;@;# #;"1283472613969465349";https://twitter.com/beagj/status/1283472613969465349
jeffruffolo;2020-07-15 14:44;3;11;"I'm excited to share our work applying deep learning to antibody structure prediction at # ISMB2020 3D-SIG today at 5 PM EST! More details also available in our recent paper in Bioinformatics https://academic.oup.com/bioinformatics/article/36/Supplement_1/i268/5870520 …";;;#;"1283472475439992833";https://twitter.com/jeffruffolo/status/1283472475439992833
ISCB_RegSys;2020-07-15 14:39;2;11;"Our second # RegSys2020 keynote from @ sara_mostafavi on immune cell regulatory elements. Deep learning model predicts ATAC-seq accessibility across mouse immune cells - loss function v important. Model generalises to Human data & finds known TFs # ISMB2020 https://www.biorxiv.org/content/10.1101/2019.12.21.885814v1 …";;@;# #;"1283471378654597122";https://twitter.com/ISCB_RegSys/status/1283471378654597122
Annhled6;2020-07-15 14:37;0;7;"The talk of @ sara_mostafavi about deep learning of immune cell differentiation got me like # ISMB2020 # RegSys2020pic.twitter.com/7gFYjBtAR7";;@;# #;"1283470858133164044";https://twitter.com/Annhled6/status/1283470858133164044
ProfMilenkovic;2020-07-15 14:35;2;7;"Check out # NetBio # ISMB2020 presentations by @ ND_CSE PhD students: @ QILI427's 4:10pm EDT talk on studying aging from dynamic biological network data (https://arxiv.org/abs/2005.03659 ) and @ shawngu11's poster on data-driven network alignment (https://journals.plos.org/plosone/article?id=10.1371/journal.pone.0234978 …)";;@ @ @;# #;"1283470170531528704";https://twitter.com/ProfMilenkovic/status/1283470170531528704
Chandrima_04;2020-07-15 14:34;1;4;"Fantastic talk from @ AmyDWillis on quantifying microbial abundances across 16S and shotgun metagenomics studies! @ ISMB20 # ismb @ iscb # ISMB2020 pic.twitter.com/gdSFjAJSWh";;@ @ @;# #;"1283469943766384643";https://twitter.com/Chandrima_04/status/1283469943766384643
Vivekdna;2020-07-15 14:32;0;2;"Congratulations to a wonderful JAX colleague! well deserved.";;;;"1283469622159773697";https://twitter.com/Vivekdna/status/1283469622159773697
auslandcat;2020-07-15 14:32;2;9;"Relative abundance data is not necessarily repesentative from the sample it is taken from, it "can mislead you" says @ AmyDWillis in a fascinating # microbiome keynote # ISMB2020";;@;# #;"1283469380685373442";https://twitter.com/auslandcat/status/1283469380685373442
simonrasmu;2020-07-15 14:29;0;1;"And forgot to tag it with the conference. Here it is # ismb2020";;;#;"1283468831978131457";https://twitter.com/simonrasmu/status/1283468831978131457
galaxyproject;2020-07-15 14:20;3;8;"Democratizing DIA analysis on public cloud infrastructures via Galaxy, # ISMB2020 talk by Matthias Fahrner, starting in 30 minutes in the CompMS COSI https://www.iscb.org/cms_addon/conferences/ismb2020/tracks/compmscosi … # UseGalaxypic.twitter.com/Csknw0EsCQ";;;# #;"1283466358760538115";https://twitter.com/galaxyproject/status/1283466358760538115
mahonylab;2020-07-15 14:19;1;2;"SM: Neural network to find seq features associated with each of 90 different immune-related cell types from 500K ATAC-seq open regions. Multi-label setting. # RegSys2020 # ISMB2020";;;# #;"1283466115885260801";https://twitter.com/mahonylab/status/1283466115885260801
serghei_mangul;2020-07-15 14:15;3;4;"@ nlapier2 will present our tools for metagenomic profiling via containment min hash in a few minutes at @ HiTSeq # ISMB2020 Preprint is here https://www.biorxiv.org/content/10.1101/2020.01.17.910521v1.abstract … @ DavidKoslicki @ ZarEskinCompMed @ mealserhttps://twitter.com/MangulLab/status/1283461600737988609 …";;@ @ @ @ @;#;"1283465244472299520";https://twitter.com/serghei_mangul/status/1283465244472299520
hsailem;2020-07-15 14:10;1;1;"The third session of # BioVis at # ISMB2020 kicks off with a talk from @ marinkazitnik on bridging machine learning and data visualisation";;@;# #;"1283464088543211521";https://twitter.com/hsailem/status/1283464088543211521
blucher_a;2020-07-15 14:10;3;5;"Second keynote in # ISMB2020 # biovis: @ marinkazitnik outlines opportunities for ML in # drugrepurposing at each step in the pipelinepic.twitter.com/7v02zdYdNM";;@;# # #;"1283463934830194689";https://twitter.com/blucher_a/status/1283463934830194689
iscb;2020-07-15 14:07;0;2;"Not receiving emails from iscb_conferences@iscb.org? Quick tricks to try: Double check Promotions tab in Gmail, Junk/Trash folders and lastly your Spam filters! Don't miss a minute of ISMB 2020. Stay in the know, double check the quick tricks! # ISMB2020";;@iscb;#;"1283463087098679298";https://twitter.com/iscb/status/1283463087098679298
statesdj;2020-07-15 14:05;0;0;"Congrats, nice!";;;;"1283462660693032960";https://twitter.com/statesdj/status/1283462660693032960
mkutmon;2020-07-15 14:03;0;1;"@ BaudotAnais kicking off the afternoon session of the # ISMB2020 # netbio. Looking forward to the keynote by Anastasia Baryshnikova!";;@;# #;"1283462268622168065";https://twitter.com/mkutmon/status/1283462268622168065
LuciaScience;2020-07-15 14:01;12;35;"# ISMB2020 Great lunch and learn with @ JeneaIA @ blkwomencompbio. We should all sit at the table together. At @ iscb we are committed to increase # equity # diversity # inclusion in CompBio. And we are counting on all our members to make it happen";;@ @ @;# # # #;"1283461793877118976";https://twitter.com/LuciaScience/status/1283461793877118976
jmschreiber91;2020-07-15 13:58;0;5;"Attending @ ISMBinfo # ISMB2020 but saddened by the lack of happy hours? You're in luck! A virtual happy hour is happening today after the talks. Read more here: https://docs.google.com/document/d/12sH-L5Hd_lZV8gvnsco4nHDCTFfYvyNrVtQ8gloS8_E …";;@;#;"1283460968719110146";https://twitter.com/jmschreiber91/status/1283460968719110146
vickyhellon;2020-07-15 13:53;4;9;"from the question 'how best to be an ally at the moment' @ JeneaIA advises researchers (and particularly faculty members!) to check out the # BlackintheIvory hashtag and the nature editorial- http://nature.com/articles/d41586-020-01741-7 … # ISMB2020";;@;# #;"1283459619621347333";https://twitter.com/vickyhellon/status/1283459619621347333
biovis_net;2020-07-15 13:49;3;3;"It's time for our second great keynote by the wonderful @ marinkazitnik from @ HarvardDBMI who will speak about machine learning for drug repurposing. **Starting in 11.0min** We hope you're as excited as we are! # ISMB2020 # biovispic.twitter.com/PJs2JS6vNv";;@ @;# #;"1283458557355016193";https://twitter.com/biovis_net/status/1283458557355016193
vickyhellon;2020-07-15 13:47;3;6;"Vital talk from @ JeneaIA on the @ blkwomencompbio network- fascinating to hear some of the members experiences and the broad work they are up to # ISMB2020 pic.twitter.com/5NACq0CesB";;@ @;#;"1283458289288843265";https://twitter.com/vickyhellon/status/1283458289288843265
mahonylab;2020-07-15 13:47;3;15;"Up next at 2pm: keynote by @ sara_mostafavi "Deep Learning of Immune Differentiation". # RegSys2020 # ISMB2020";;@;# #;"1283458116282191872";https://twitter.com/mahonylab/status/1283458116282191872
pa_agarwal;2020-07-15 13:46;0;2;"Thanks to # ISMB2020/ @ ISCB: first talk ISMB'94 with @ Rbaltman org.; org. ISMB '96 with @ statesdj & @ terrygaaster; lucky to help co-found @ ISCB with @ ProfLHunter et al. Left @ GSK last year after 22 fabulous years. Excited to release my first product https://FindExpertMD.com .";;@ @ @ @ @ @ @;#;"1283457956839923713";https://twitter.com/pa_agarwal/status/1283457956839923713
auslandcat;2020-07-15 13:45;0;5;"Incredible and insightful # ISMB2020 Lunch & Learn by Ph.D student @ JeneaIA on @ blkwomencompbio, a powerful network to empower black women comp biologists and for advocacy and resources. Thank you for your time and presentation.";;@ @;#;"1283457559626690560";https://twitter.com/auslandcat/status/1283457559626690560
_tanunia;2020-07-15 13:34;0;3;"One more great talk from our lab at # ISMB2020 today! https://twitter.com/bioinf_spbu/status/1283413931831242758 …";;;#;"1283454904770723840";https://twitter.com/_tanunia/status/1283454904770723840
Annhled6;2020-07-15 13:31;1;5;"So many interesting talks that I just don't know how to choose one # NetBio # ISMB2020 # RegSys2020 https://twitter.com/mkutmon/status/1283412792716824576 …pic.twitter.com/pPYFFcvkIq";;;# # #;"1283454091360862209";https://twitter.com/Annhled6/status/1283454091360862209
MGFerrarini;2020-07-15 13:27;0;7;"Amazing meet and greet with @ JeneaIA from @ blkwomencompbio ! You inspire me. I’d be honored to seat at your table # ISMB2020 pic.twitter.com/SEmeCaQoC5";;@ @;#;"1283453122644447232";https://twitter.com/MGFerrarini/status/1283453122644447232
Tiff_callahan;2020-07-15 13:25;4;9;"Always thrilled to talk about KGs, but even more excited to be doing it at my first # ISMB2020 # bioont2020! I will be presenting some preliminary results from on-going work with @ ignaciot, @ ProfLHunter https://www.biorxiv.org/content/10.1101/2020.04.30.071407v1 …";;@ @;# #;"1283452593126076417";https://twitter.com/Tiff_callahan/status/1283452593126076417
FawazDabbaghieh;2020-07-15 13:21;0;2;"# ISMB2020virtualeats Soy-honey glazed chicken burgers, what’s everyone eating during # ISMB2020? Too bad we can’t get poutine in Montreal this year pic.twitter.com/SghhOFPMD3";;;# #;"1283451627190575104";https://twitter.com/FawazDabbaghieh/status/1283451627190575104
biovis_net;2020-07-15 13:15;2;3;"Thanks a lot for sharing all your phenomenal work with us! We hope the recording will be available soon for everyone. Also, thewill forever stay in our hearts! # ISMB2020 # BioVis # VISxAI # PuppyInACuphttps://twitter.com/hen_str/status/1283447214896025600 …";;;# # # #;"1283450028351205376";https://twitter.com/biovis_net/status/1283450028351205376
Winter_Madness_;2020-07-15 13:07;2;5;"Excited to attend the # ISMB2020 Lunch & Learn on The Black Women in Computational Biology Network presented by Ph.D student Jeneal Adams @ JeneaIA @ blkwomencompbiopic.twitter.com/7iv5c03kbd";;@ @;#;"1283448131045253120";https://twitter.com/Winter_Madness_/status/1283448131045253120
Hossein_SHN;2020-07-15 13:06;0;4;"# ISMB2020 —> # ICML2020 —> # WCB2020 what a fun busy week!https://twitter.com/elhamazizi/status/1283445786034999297 …";;;# # #;"1283447860982198272";https://twitter.com/Hossein_SHN/status/1283447860982198272
news4go;2020-07-15 13:01;1;12;"A huge congratulations to our own PI @ jb2270, who was just recognized for her hard work with the well-deserved 2020 Outstanding Contributions to @ iscb Award!!! Read more: https://www.iscb.org/iscb-awards/4255 … @ jacksonlabpic.twitter.com/22z1jPiVFY";;@ @ @;;"1283446631711432706";https://twitter.com/news4go/status/1283446631711432706
gjbarton;2020-07-15 12:57;4;15;"# ISMB2020 please come along to the session tomorrow "Is computational biology contributing to the climate crisis?" We have three great speakers: Alex Bateman, @ Alexbateman1 Fernanda Foertter @ hpcprogrammer and Mike Inouye, @ minouye271 and time for discussion! Starts at 10:40 EDT";;@ @ @;#;"1283445640127807488";https://twitter.com/gjbarton/status/1283445640127807488
mkutmon;2020-07-15 12:55;0;0;"Great first session of # ISMB2020 # NetBio. Looking forward to more talks after the (lunch/dinner/coffee) break!";;;# #;"1283445156750950402";https://twitter.com/mkutmon/status/1283445156750950402
alliancegenome;2020-07-15 12:54;16;23;"We would like to congratulate our co-PI Dr. Judith Blake, the 2020 recipient of the Outstanding Contributions to ISCB International Society for Computational Biology Award. https://www.iscb.org/iscb-awards/4255 … @ mgi_mouse @ news4go @ iscb pic.twitter.com/Gltw9togZs";;@ @ @;;"1283444934842908672";https://twitter.com/alliancegenome/status/1283444934842908672
EmilyEAckerman;2020-07-15 12:53;3;4;"Tomorrow, July 16, I'll be presenting my talk, "Identifying Regulators of Infection in Virus-Host Networks" at 12:20 PM EDT in the NetBio track. Hope to see you all there! # ISMB2020 pic.twitter.com/RhK8wSq0yB";;;#;"1283444560878874629";https://twitter.com/EmilyEAckerman/status/1283444560878874629
mlaval6;2020-07-15 12:45;6;11;"# ISMB2020 attendees, come listen to undergraduate student @ yunenchung7271 today at 5PM (EDT) in the # CompMS COSI. His work (collaboration with @ DanielFigeys) on real-time mass spectrometry was recently published in JASMS @ asmsnews @ iscb @ uOttawaTMM # ISMB https://iscb-ismb20.myconferencenow.com/poster/mealtime-ms-a-machine-learning-guided-real-time-mass-spectrometry-analysis-for-protein-identification-and-efficient-dynamic-exclusion/ …";;@ @ @ @ @;# # #;"1283442503497244673";https://twitter.com/mlaval6/status/1283442503497244673
DruggableGenome;2020-07-15 12:39;1;3;"Reactome group is part of IDG's Cutting Edge Informatics Tool awardees. Please catch up with them at # ISMB2020. https://twitter.com/reactome/status/1283377394469003266 …";;;#;"1283441125865316353";https://twitter.com/DruggableGenome/status/1283441125865316353
AmyDWillis;2020-07-15 12:39;0;12;"Wow! The # ISMB2020 # Microbiome talks so far have blown me away with their professionalism and clarity. Pre-recording talks takes work but these have been some of the clearest talks I've ever seen. Congrats to all presenters and *thank you* for making this a great session!";;;# #;"1283441063093342209";https://twitter.com/AmyDWillis/status/1283441063093342209
ISCB_RegSys;2020-07-15 12:38;4;7;"Yi Liu from the Rockova/Reinitz labs @ uchicago - start with a thermodynamic model of eve activity in D. mel embryo stripes and translate it into a neural network. Can predict activity of Sepsid enhancer in Drosophila https://academic.oup.com/bioinformatics/article/36/Supplement_1/i499/5870526 … # RegSys2020 # ISMB2020";;@;# #;"1283440833178546176";https://twitter.com/ISCB_RegSys/status/1283440833178546176
WonderMixTape;2020-07-15 12:37;0;0;"Assessing if consensus features improve response prediction in patients samples # ismb2020 # transmedpic.twitter.com/FiopGD9Cil";;;# #;"1283440572359823360";https://twitter.com/WonderMixTape/status/1283440572359823360
SysBioCurie;2020-07-15 12:36;3;8;"COVID-19 Disease Map is presented by Inna Kuperstein at # ISMB2020 conference during COVID-19 special session https://drive.google.com/file/d/1F5w06c0PIqSVKQyp5W5CKirBJ0rUn450/view?usp=sharing …";;;#;"1283440278498672640";https://twitter.com/SysBioCurie/status/1283440278498672640
WonderMixTape;2020-07-15 12:33;0;1;"Nice use of non-linear principal components (NLPCs) to align pre-clinical model and tumor # ISMB2020 # transmedpic.twitter.com/Vas0Zggar4";;;# #;"1283439675869245442";https://twitter.com/WonderMixTape/status/1283439675869245442
Celebi_Remzi_;2020-07-15 12:33;0;0;"@ SenayKafkas I forgot to tag you # BioOnt2020 # ISMB2020";;@;# #;"1283439451147055104";https://twitter.com/Celebi_Remzi_/status/1283439451147055104
WonderMixTape;2020-07-15 12:30;2;2;"# ISMB2020 # transmed @ souf_mourra PRECISE+ predicts drug response in patients by non-linear subspace based transfer from cell lines and PDX models Paper here:https://bit.ly/Preciseplus";;@;# #;"1283438788899794944";https://twitter.com/WonderMixTape/status/1283438788899794944
