username;date;retweets;favorites;text;geo;mentions;hashtags;id;permalink
EvolComp;2020-07-14 16:34;1;1;"How to find the two phylogenetic positions of a set of reads from a sample of two organisms, given the set of mixed reads and a separate set of reads for several reference present genomes ? Great talk by Metin Balaban @ EvolComp # ISMB2020 presenting an algorithmic solution.";;@;#;"1283137854361788418";https://twitter.com/EvolComp/status/1283137854361788418
hoondy;2020-07-14 16:31;0;0;"Nevermind. I realized most of # ISMB2020 talks are pre-recorded except for invited speakers. https://www.iscb.org/ismb2020/3968";;;#;"1283137034975158272";https://twitter.com/hoondy/status/1283137034975158272
NIHDataScience;2020-07-14 16:26;9;12;"Our last speaker is @ prpayne5 from the @ WashUi2 discussing how we can integrate biomedical # informatics and # datascience to prepare the # PrecisionMedicine workforce. # ISMB2020 # ISMBODSS";;@ @;# # # # #;"1283135765464178689";https://twitter.com/NIHDataScience/status/1283135765464178689
CAMDA_conf;2020-07-14 16:24;1;2;"Improving Deep Learning Performance on Prediction of Drug-Induced Liver Injury. By Peter Tran, Saint Louis University, U.S.A. # camda2020 # ISMB2020 pic.twitter.com/f8ft1if2K7";;;# #;"1283135276798414850";https://twitter.com/CAMDA_conf/status/1283135276798414850
EvolComp;2020-07-14 16:22;0;3;"Great talk by @ soumitrakp @ EvolComp # ISMB2020 presenting EvoGeneX that tackles the timely interesting problem of modeling gene expression evolution. Application to Drosophila data allows to uncover differences in evolution of species, organs and sexes.";;@ @;#;"1283134923789008897";https://twitter.com/EvolComp/status/1283134923789008897
drsbello;2020-07-14 16:21;0;2;"Virtual meetings definitely facilitate my session hopping habits, unfortunately without the steps I would get in at an in-person meeting but happily without the social awkwardness # ISMB2020 pic.twitter.com/o9yL9wlp4N";;;#;"1283134522628939779";https://twitter.com/drsbello/status/1283134522628939779
hoondy;2020-07-14 16:15;0;1;"I noticed some presenter pre-recorded their talk and played the video through zoom. One advantage of this is that you can exactly time your talk, but what if you were interrupted? # ISMB2020";;;#;"1283133015204429824";https://twitter.com/hoondy/status/1283133015204429824
AedinCulhane;2020-07-14 16:14;2;5;"Very nice presentation from yingxin lin on @ Bioconductor package scClassify at # ISMB2020 https://bioconductor.org/packages/release/bioc/html/scClassify.html …pic.twitter.com/z6pevDgaWl";;@;#;"1283132832160911363";https://twitter.com/AedinCulhane/status/1283132832160911363
NIHDataScience;2020-07-14 16:09;0;1;"Specifically, Dr. Bahar is discussing a joint program between @ PittTweet and @ CarnegieMellon # ISMB2020 # ISMBODSS";;@ @;# #;"1283131540344643584";https://twitter.com/NIHDataScience/status/1283131540344643584
EvolComp;2020-07-14 16:08;0;1;"Another great talk by John Lee @ EvolComp # ISMB2020 presenting, CoCoCoNet, a webserver for identifying conserved gene modules and comparing co-expression networks across species.";;@;#;"1283131290598940677";https://twitter.com/EvolComp/status/1283131290598940677
ngehlenborg;2020-07-14 16:08;1;19;"My # ismb2020 @ _hubmap Special Session talk is about to kick off. Learn more about the exploration, provenance, and # datavis features of the HuBMAP Data Portal which will be released within the next few weeks. See you in Channel 9! PS. I’m hiring postdocs with interest in # biovis!pic.twitter.com/0Fi59VvQrb";;@;# # #;"1283131284068487170";https://twitter.com/ngehlenborg/status/1283131284068487170
NIHDataScience;2020-07-14 16:06;3;5;"Next up is Ivet Bahar from the @ PittTweet School of Medicine offering lessons from 15 years of training computational biologists. # ISMB2020 # ISMBODSS";;@;# #;"1283130881478205440";https://twitter.com/NIHDataScience/status/1283130881478205440
EvolComp;2020-07-14 16:03;0;0;"Increased expression of supragranular-enriched genes in frontal cortex layer III is concomitant with an expansion in cortico-cortical pathways projecting within the frontal cortex in humans relative to mice. Fascinating talk by Chirstine Charvet @ EvolComp # ISMB2020:";;@;#;"1283130071461527557";https://twitter.com/EvolComp/status/1283130071461527557
bhattac_a_bt;2020-07-14 16:00;3;6;"Tomorrow, 7/15,12 pm EDT at # ISMB2020 VarI COSI, check out my talk on MOSTWAS, a TWAS extension that prioritizes distal variants in transcriptomic prediction and association testing, with @ mikelove and @ yunliunc. Preprint: https://tinyurl.com/yaojchxu Schedule: https://tinyurl.com/yc73l65q";;@ @;#;"1283129251705823232";https://twitter.com/bhattac_a_bt/status/1283129251705823232
MarkGerstein;2020-07-14 15:58;5;11;"Interesting talk by Maria Littman at # ISMB2020 showing how similarities between embeddings of protein sequences do better than direct sequence homology in predicting protein function (work with @ BurkhardRost, https://github.com/Rostlab/goPredSim …)";;@;#;"1283128836872437770";https://twitter.com/MarkGerstein/status/1283128836872437770
KorcsmarosLab;2020-07-14 15:58;4;4;"We developed the ViralLink workflow to investigate # SARSCoV2 infection with cell specific # networks. @ mdeske is presenting it now at # ISMB2020 among the # COVID19 posters. You can watch his short-talk here: https://youtu.be/-ACmcC4YwsU Or check the preprint:https://www.biorxiv.org/content/10.1101/2020.06.23.167254v2 …";;@;# # # #;"1283128703992692739";https://twitter.com/KorcsmarosLab/status/1283128703992692739
EvolComp;2020-07-14 15:54;0;0;"Great work by @ lsunderm @ EvolComp # ISMB2020 presenting, SubMARine, a polynomial-time algorithm to build a partial clone tree that allows to reconstruct tumor evolutionary histories in the case of cancers with many subclonal populations.";;@ @;#;"1283127759674445826";https://twitter.com/EvolComp/status/1283127759674445826
Annhled6;2020-07-14 15:47;0;4;"For someone with a biomedical formation & starting with data & computational science the talk of Alex T. Bui has been inspiring & has taught me I'm not alone at this # ISMB2020 # ODSSISMB";;;# #;"1283125867212705793";https://twitter.com/Annhled6/status/1283125867212705793
NIHDataScience;2020-07-14 15:44;1;2;"Next up we have Kara Hall, Director of the Science of Team Science (SciTS) Team at @ NCICancerCtrl, presenting on fostering a collaborative workforce. # ISMB2020 # ISMBODSS # NIHData";;@;# # #;"1283125292710735885";https://twitter.com/NIHDataScience/status/1283125292710735885
NIHDataScience;2020-07-14 15:41;1;3;"Alex Bui, @ dgsomucla, is sharing examples of how he's implementing a team approach to data science training with students. # ISMB2020 # ISMBODSSpic.twitter.com/cH8RW7A7Pa";;@;# #;"1283124583021805568";https://twitter.com/NIHDataScience/status/1283124583021805568
EvolComp;2020-07-14 15:39;0;0;"Very interesting talk by Ron Zeira @ EvolComp # ISMB2020 introducing Weighted Copy Number Distance with events weighted according to their type/length/location for reconstructing Copy Number Evolution in Cancer.";;@;#;"1283123909781585927";https://twitter.com/EvolComp/status/1283123909781585927
celia_vgelder;2020-07-14 15:26;21;27;"Interested in Bioinformatics Training and in the global bioinformatics trainer community @ mygobletorg ? See our # ISMB2020 pitch (http://tiny.cc/cqggsz ) & poster (http://tiny.cc/tpggsz ) We love to talk with you about what GOBLET can do for you and what you can do for GOBLET!pic.twitter.com/3DaqkLCFKf";;@;#;"1283120628774600704";https://twitter.com/celia_vgelder/status/1283120628774600704
CAMDA_conf;2020-07-14 15:24;1;0;"Prediction of Drug Induced Liver Injury with different data sets and different end points. By Witold Rudnicki , University of Bialystok, Poland # ISMB2020 # camda2020pic.twitter.com/zJXN6AGeDd";;;# #;"1283120278256615426";https://twitter.com/CAMDA_conf/status/1283120278256615426
pawel_labaj;2020-07-14 15:24;1;3;"Thanks for joinng and providing valuable comments and ideas!";;;;"1283120213593141253";https://twitter.com/pawel_labaj/status/1283120213593141253
NIHDataScience;2020-07-14 15:21;1;2;"Our next speaker is Alex T. Bui with @ dgsomucla discussing "Training at the intersection: Bringing together computation and biomedicine" # ISMB2020 # ISMBODSS";;@;# #;"1283119511797891075";https://twitter.com/NIHDataScience/status/1283119511797891075
harry_caufield;2020-07-14 15:18;1;2;"The third session of the ODSS Sessions at # ISMB2020 is starting shortly! Topic is training and workforce development in # AI, # MachineLearning, and biomedicine # ISMBODSS";;;# # # #;"1283118752335192065";https://twitter.com/harry_caufield/status/1283118752335192065
Victoria_L_A;2020-07-14 15:15;0;0;"I don't like 'elevator' music, but I don't dislike it either. I've seen a lot of people complain about it... For me it serves as a 'last call' or some sort of indicator to go back to my seat and continue with the next talk. # ISMB2020";;;#;"1283118023507939333";https://twitter.com/Victoria_L_A/status/1283118023507939333
EvolComp;2020-07-14 15:15;0;2;"Great talk by David Sankoff @ EvolComp # ISMB2020 on exploiting the synergy between synteny-based and similarity-based approaches to increase the number of parameters that can be estimated for the model of polyploidization-fractionation cycle.";;@;#;"1283117832495157249";https://twitter.com/EvolComp/status/1283117832495157249
RGBerkson;2020-07-14 15:08;0;0;"Occasionally dipping out of the # EducationCOSI track to hear exciting cancer talks. Really appreciated Claudia Kleinman's work on using cell atlas data to deduce the developmental origin of childhood brain tumours # ISMB2020";;;# #;"1283116235186671621";https://twitter.com/RGBerkson/status/1283116235186671621
mmarchin;2020-07-14 15:04;0;3;"Interesting talk by Matthew DeCamp about the ethics of AI in biomedicine. "tools can change the way we think and the way we act" # ISMB2020";;;#;"1283115283432050690";https://twitter.com/mmarchin/status/1283115283432050690
NIHDataScience;2020-07-14 14:59;0;1;""AI has great potential for improving health, but it is critical to understand the potential for ethical issues and unintended consequences." --Bradley Malin, @ COBioethics # ISMB2020 # ISMBODSS";;@;# #;"1283114010804617216";https://twitter.com/NIHDataScience/status/1283114010804617216
matt1me;2020-07-14 14:59;2;3;"At # ISMB2020? Free tomorrow between 12:30-12:40EDT? Then come and see my presentation in the # CompMS Cosi! I'll be presenting our recent Structure paper where we show the usefulness of monolinks from a crosslink experiment for modelling protein structures. https://www.cell.com/structure/fulltext/S0969-2126(20)30202-1 …pic.twitter.com/bptefvsgt3";;;# #;"1283113820358148096";https://twitter.com/matt1me/status/1283113820358148096
iddux;2020-07-14 14:58;0;3;"Me giving a talk at ISMB2366 # ISMB2020 pic.twitter.com/17llJW9P3X";;;#;"1283113663990083584";https://twitter.com/iddux/status/1283113663990083584
harry_caufield;2020-07-14 14:57;0;3;"Matthew DeCamp: we need to find a balance for AI in clinical decisions, not under or over-reliance. They may follow AI decisions out of fear of legal liability, or just defer to it. We get de facto autonomous AI. # ISMB2020 # ISMBODSS";;;# #;"1283113292332855296";https://twitter.com/harry_caufield/status/1283113292332855296
enit7677;2020-07-14 14:54;0;0;"# ISMB2020 Great session, teriffic organisation. Yet the virtual format doesn’t do it for me. Hope to meet in person (circumstances permitting) or at the holodeck soon.";;;#;"1283112686914613250";https://twitter.com/enit7677/status/1283112686914613250
Hossein_SHN;2020-07-14 14:53;0;9;"Learning domain-invariant representations is getting more and more important in addressing biomedical challenges # ISMB2020. https://twitter.com/gxr/status/1283074750160539656 …";;;#;"1283112460271009793";https://twitter.com/Hossein_SHN/status/1283112460271009793
EvolComp;2020-07-14 14:51;4;8;"Amazing talk by Gurmeet Kaur @ EvolComp # ISMB2020 on the discovery of novel highly-regulated chaperone-based systems, likely used as survival tactic by prokaryotes with complex lifecycles.";;@;#;"1283111900423888898";https://twitter.com/EvolComp/status/1283111900423888898
lubianat;2020-07-14 14:47;1;3;"Now @ coletrapnell talking about embryo transcriptomics and "sci-Space, a scale-flexible method for spatial transcriptomics" . Exciting stuff! # ISMB2020";;@;#;"1283110934823788545";https://twitter.com/lubianat/status/1283110934823788545
EvolComp;2020-07-14 14:45;0;2;"The presence/absence of ramp sequences is largely congruent with the Open Tree of Life. Great talk by Lauren McKinnon at @ EvolComp # ISMB2020";;@;#;"1283110466940817410";https://twitter.com/EvolComp/status/1283110466940817410
NIHDataScience;2020-07-14 14:44;2;0;"Now hearing from Matthew DeCamp at @ COBioethics on ethics, bias, and the adoption of # AI in # biomedicine. # ISMB2020 # ISMBODSS";;@;# # # #;"1283110249092861954";https://twitter.com/NIHDataScience/status/1283110249092861954
GonzaParra_;2020-07-14 14:41;4;12;"Great talk by Christine Orengo about the new CATH version at # ismb2020! As a detail from the talk it was nice to see they are now using linclust from @ thesteinegger!";;@;#;"1283109357178281991";https://twitter.com/GonzaParra_/status/1283109357178281991
drsbello;2020-07-14 14:41;0;1;"Things I learned at # ISMB2020 today, Ramp sequences = regions of rarely used codon clusters at the start of a gene which slow down translation of the mRNA into protein.";;;#;"1283109302086107143";https://twitter.com/drsbello/status/1283109302086107143
RasVerena;2020-07-14 14:38;3;27;"I felt like that student scheduled between the professors but it was great to present some of our recent training experiences to the international bioinformatics community community. # ISMB2020 https://twitter.com/Nicky_Mulder/status/1283104103372148737 …";;;#;"1283108718675136517";https://twitter.com/RasVerena/status/1283108718675136517
cnscenter;2020-07-14 14:33;1;2;"Happening NOW: HuBMAP at ISMB 2020! https://www.iscb.org/ismb2020-program/special-sessions#sst05 … # ismb2020 @ _hubmap @ SnyderShot @ coletrapnell @ nicknystrom @ CMUCompBio @ ngehlenborg @ katycns @ genome_govpic.twitter.com/g7vhAEgeLq";;@ @ @ @ @ @ @ @;#sst05 #;"1283107278078517251";https://twitter.com/cnscenter/status/1283107278078517251
harry_caufield;2020-07-14 14:29;1;1;"Bradley Malin: Not all data should be public, but it should be verifiable. For AI, we need to consider where and when data may be encrypted vs. compute (i.e., send the compute to the data) # ISMB2020 # ISMBODSS";;;# #;"1283106353196613632";https://twitter.com/harry_caufield/status/1283106353196613632
AedinCulhane;2020-07-14 14:25;0;3;"Wouldn’t miss it :-)";;;;"1283105386610950144";https://twitter.com/AedinCulhane/status/1283105386610950144
NIHDataScience;2020-07-14 14:24;1;2;"Next up is Bradley Malin from @ VUMChealth discussing data sharing challenges for biomedical AI. # ISMB2020 # ISMBODSS # AI # artificialintelligence # datasharing";;@;# # # # #;"1283105180989497345";https://twitter.com/NIHDataScience/status/1283105180989497345
m4ri4pch;2020-07-14 14:21;6;14;"It has been an honor to present our mechanistic approach to Connectivity Map profiling at # camda2020 # ISMB2020. Thanks to @ loucerac, @ MarinaEM10, @ 22_mlsanchez and all @ ClinicalBioinfo! I owe you ! @ ibis_sevilla @ FProgresoysalud @ CIBERERhttps://twitter.com/CAMDA_conf/status/1283074729260310528 …";;@ @ @ @ @ @ @;# #;"1283104471497793556";https://twitter.com/m4ri4pch/status/1283104471497793556
blucher_a;2020-07-14 14:21;0;11;"Now at the # ISMB2020 @ timnitGebru on AI ethics; so many good discussion points here -Another # ISMBODSS talk I'd love to listen to for a full length seminar!!pic.twitter.com/08aVpKEr2A";;@;# #;"1283104270322003970";https://twitter.com/blucher_a/status/1283104270322003970
Nicky_Mulder;2020-07-14 14:20;5;22;"@ RasVerena just gave a great talk at # ISMB2020 Education session on our @ H3ABioNet Intermediate Bioinformatics course. Got nice responses in the chat and great questions.pic.twitter.com/MQyXC6g2cK";;@ @;#;"1283104103372148737";https://twitter.com/Nicky_Mulder/status/1283104103372148737
canicamxli;2020-07-14 14:18;2;6;"@ RasVerena from @ H3ABioNet talking about about the implementation of advanced bioinformatics education across Africa at the # ISMB2020 # EducationCOSI pic.twitter.com/NIHVXYsrIj";;@ @;# #;"1283103674026393604";https://twitter.com/canicamxli/status/1283103674026393604
metricausa;2020-07-14 14:18;4;18;"‘Omics computational pipeline builders and users have options. Stories include @ ctitusbrown, P. Boutros @ UCLA, J.Zhang @ StJudeResearch, B.Nystedt @ Scilifelab, teams at @ emblebi and @ dnanexus. Here https://go.nature.com/3ibHCSb and https://bit.ly/2Aessuh and a podcast. # ISMB2020";;@ @ @ @ @ @;#;"1283103648797593600";https://twitter.com/metricausa/status/1283103648797593600
P_Palagi;2020-07-14 14:17;3;7;"I'm looking forward to Diana Marek's presentation on @ ISBSIB training later in # ISMB2020 # EducationCOSI track. She will present how we integrate best practices ( @ ELIXIREurope, @ mygobletorg, @ ISCBedu and our own) to enhance # bioinformatics # training in Switzerland.";;@ @ @ @;# # # #;"1283103406689853446";https://twitter.com/P_Palagi/status/1283103406689853446
GonzaParra_;2020-07-14 14:16;1;13;"Conference talks SHOULD always be prerecorded. A lot of people get so nervous even when having great pieces of work & because of that the presentation is poor. The aim in conferences is to communicate knowledge not to know how good you are at performing under pressure # ismb2020";;;#;"1283103116456415232";https://twitter.com/GonzaParra_/status/1283103116456415232
harry_caufield;2020-07-14 14:16;3;1;". @ timnitGebru : Our datasets are made of people, not objects - large scale ML is the the "wild west" of data collection # ISMB2020 # ISMBODSS https://dl.acm.org/doi/abs/10.1145/3351095.3372829 …";;@;# #;"1283103010155933697";https://twitter.com/harry_caufield/status/1283103010155933697
pkoo562;2020-07-14 14:14;11;54;"At # ISMB2020, check out my talk entitled “Can we trust deep learning predictions in genomics?” today at 5:30p (EDT) in the # MLCSB track. This is work with @ MPloenzke";;@;# #;"1283102694446714881";https://twitter.com/pkoo562/status/1283102694446714881
iddux;2020-07-14 14:09;3;7;"Starting now at Channel 2, # FunctionCOSI # ISMB2020: three CAFA4 top performers giving talks: Shanfeng Zhu,, Hongryul Ahn, and Christine Orengo @ CATHDatabase";;@;# #;"1283101357138800641";https://twitter.com/iddux/status/1283101357138800641
harry_caufield;2020-07-14 14:07;2;1;"Now: @ timnitGebru reviews the challenges in obtaining truly diverse data sets - face data exemplifies many disparities. Some computational tasks may just be harmful # ISMB2020 # ISMBODSS";;@;# #;"1283100928027975682";https://twitter.com/harry_caufield/status/1283100928027975682
AnaBetty2304;2020-07-14 14:07;1;5;"Can't wait to use @ GenePattern! It looks incredible. <conda install genepattern-notebook> right now # ISMB2020 https://twitter.com/mmreich/status/1282828485635870727 …";;@;#;"1283100765414780928";https://twitter.com/AnaBetty2304/status/1283100765414780928
NIHDataScience;2020-07-14 14:06;5;1;"Kicking off our afternoon session is Timnit Gebru, the technical co-lead of the ethical # artificialintelligence team at Google Research. She is discussing strategies for collecting sociocultural data in # MachineLearning # ISMB2020 # ISMBODSS";;;# # # #;"1283100485877223426";https://twitter.com/NIHDataScience/status/1283100485877223426
vickyhellon;2020-07-14 14:04;0;1;"Thanks for having me # ISMB2020 - if you'd like to join our # codereview working group then please get in touch at publishers@f1000.comhttps://twitter.com/F1000Research/status/1283009103665729538 …";;@f1000;# #;"1283099947961929731";https://twitter.com/vickyhellon/status/1283099947961929731
kieranrcampbell;2020-07-14 14:03;1;16;"Happening now at # ISMB2020 @ KrishnaswamyLab opens the single-cell cancer genomics workshop!https://twitter.com/KrishnaswamyLab/status/1283033498891231232 …";;@;#;"1283099934334615558";https://twitter.com/kieranrcampbell/status/1283099934334615558
ConesaLab;2020-07-14 14:03;3;5;"If you missed the chance to attend our long read analysis tutorial in # ISMB2020, but are interested in learning how to use IsoSeq3, SQANTI3 and tappAS, check this out! We'll be doing it again at # ECCB2020. Registration and info https://twitter.com/eccb2020/status/1283087102561988623 …";;;# #;"1283099830080987141";https://twitter.com/ConesaLab/status/1283099830080987141
JanssenGlobal;2020-07-14 14:00;0;6;"Our Immunology team is excited to be sponsors for the @ iscb virtual ISMB 2020 Conference, a meeting highlighting the latest developments in bioinformatics and computational biology. Learn about our career opportunities in Translational Science at Janssen: https://bit.ly/30b88D2 pic.twitter.com/LAJFII9tAu";;@;;"1283098974983987208";https://twitter.com/JanssenGlobal/status/1283098974983987208
TheOperaGene;2020-07-14 13:59;1;3;"Another inspirational talk by @ garybader1 at # ISMB2020 !! I love that a discussion about gene function prediction can conclude in a way that generally encourages even more collaboration of the scientific community. Looking forward to the rest of this incredible conference! pic.twitter.com/34WCi0RwED";;@;#;"1283098871598637059";https://twitter.com/TheOperaGene/status/1283098871598637059
harry_caufield;2020-07-14 13:51;2;1;"The ODSS sessions at # ISMB2020 are starting back up shortly - now we're covering ethics and transparency in biomedical AI and data sharing. Learn how to responsibly collect and learn from data! # ISMBODSS";;;# #;"1283096808034451456";https://twitter.com/harry_caufield/status/1283096808034451456
Annhled6;2020-07-14 13:48;0;3;"Loved @ ensoesie talk today. Definitely we have to consider the social & cultural context of the people we're working with. I've worked with Latin people with MS & DM & context does impact on disease management & therefore quality of life. Inspiring # ISMB2020";;@;#;"1283096036978733056";https://twitter.com/Annhled6/status/1283096036978733056
pawel_labaj;2020-07-14 13:12;5;8;"Join "CAMDA Cafe - Grand challenges of our times" at 2pm @ CAMDA_conf COSI Cafe Connect room @ iscb Listen about CAMDA history by @ xdopazo and future challanges by Wenzhong Xiao Take part in follow up disussion # CAMDA2020 @ mason_lab @ dpkreil @ AedinCulhane @ DrRitaColwellhttps://twitter.com/CAMDA_conf/status/1283081930901258241 …";;@ @ @ @ @ @ @;#;"1283087012669673474";https://twitter.com/pawel_labaj/status/1283087012669673474
EvolComp;2020-07-14 13:00;1;1;"Very interesting talk by Yufeng Wu @ EvolComp # ISMB2020 presenting GTmix, the first method for efficiently inferring population admixture networks from haplotypes data rather than allele frequencies at individual polymorphic sites.";;@;#;"1283084045426057216";https://twitter.com/EvolComp/status/1283084045426057216
ngehlenborg;2020-07-14 12:54;6;11;"As part of the Education COSI event at # ismb2020, we are presenting a method for organizing objectives and competencies for bioinformatics subjects and using them for curriculum evaluation. Link to the poster: https://iscb-ismb20.myconferencenow.com/poster/objective-oriented-evaluation-of-a-biomedical-informatics-masters-program/ …pic.twitter.com/H7QfjDdPQH";;;#;"1283082481743405058";https://twitter.com/ngehlenborg/status/1283082481743405058
ngehlenborg;2020-07-14 12:54;1;1;"Our project on scaling # visualanalytics of clinical event sequence data through interactive state identification will be presented during the BioVis poster session at # ismb2020. We propose to support interactive state identification in OncoThreads (https://github.com/hms-dbmi/OncoThreads …).pic.twitter.com/BlRNpZ2xm8";;;# #;"1283082455487074309";https://twitter.com/ngehlenborg/status/1283082455487074309
ngehlenborg;2020-07-14 12:54;10;40;"We are presenting a few # biovis and # education related projects at # ismb2020 that I want to draw your attention to. These projects include # dataviz of patient cohorts, spatial single-cell data, and large-scale epigenomics data, as well as a curriculum mapping project.pic.twitter.com/n4YOysON5W";;;# # # #;"1283082433563435008";https://twitter.com/ngehlenborg/status/1283082433563435008
drsbello;2020-07-14 12:49;0;1;"Intriguing end to the talk by Debashish Bhattacharya in the coral session, starting to develop a tool to monitor stress in corals in the field # ISMB2020";;;#;"1283081312258203648";https://twitter.com/drsbello/status/1283081312258203648
jivarahasya;2020-07-14 12:46;5;5;"Attendees at # ISMB2020 join @ gurmeetkaur86 who will be talking on NTP-based biological conflict systems with implications for emergence of multicellularity. at 2:40 pm EST today, in the EvoCompGen COSI session. Abstract at https://www.iscb.org/cms_addon/conferences/ismb2020/tracks/EvolCompGenCOSI …";;@;#;"1283080314408099841";https://twitter.com/jivarahasya/status/1283080314408099841
rtraborn;2020-07-14 12:43;0;5;"Currently attending the 'Evolution and Comparative Genomics' track at # ISMB2020. There have been some really nice talks so far.";;;#;"1283079728509759488";https://twitter.com/rtraborn/status/1283079728509759488
cosi_sysmod;2020-07-14 12:42;0;7;"Anreas Drager @ dr_drae summarized day 2 @ SysMod/ # ISMB2020 revisiting all the talks and introducing organizing committee. Great meeting!!";;@ @;#;"1283079453783007233";https://twitter.com/cosi_sysmod/status/1283079453783007233
gxr;2020-07-14 12:41;4;15;"Learn about deep learning methods for taxonomic classification & abundance estimation on metagenomic read sets at @ HiTSeq # ISMB2020. Harun Mustafa from @ gxrlab talks 2:40pm EDT on Wed; Poster session Wed & Thu 7:45am https://tinyurl.com/y7o5jmbo ; Manuscript: https://arxiv.org/abs/1909.13146 pic.twitter.com/gKCaxkTHmM";;@ @;#;"1283079283414650882";https://twitter.com/gxr/status/1283079283414650882
