username;date;retweets;favorites;text;geo;mentions;hashtags;id;permalink
harry_caufield;2020-07-13 16:27;0;1;"Han: how can we use massive, unlabeled data to access expertise, and how do we identify signal vs. noise? How can we have it train our scientists automatically? # ISMB2020 # textmining # NLP";;;# # #;"1282773731866079233";https://twitter.com/harry_caufield/status/1282773731866079233
danfdeblasio;2020-07-13 16:23;0;1;"I have seen screenshots, but I still haven't been to a session with the giant borders. But if I'm remembering correctly, I think they had that on in the big room in Prague (see linked image) but giant screen != mobile phone.https://twitter.com/danfdeblasio/status/889848411960352768?s=20 …";;;;"1282772629619970048";https://twitter.com/danfdeblasio/status/1282772629619970048
cosi_sysmod;2020-07-13 16:19;3;9;"Serhan Yılmaz from @ cwrumstp presents his findings on the robust inference of kinase activity using functional networks at SysMod / # ISMB2020. Thereby he introduces their network-based framework named RoKAI that is available in the form of a web application.";;@;#;"1282771584906866688";https://twitter.com/cosi_sysmod/status/1282771584906866688
mdeske;2020-07-13 16:18;0;5;"Learning about # COVID19 # textmining on # ISMB2020. Not in Montreal but from home in Ely. # homeofficepic.twitter.com/rRVk1hi54i";;;# # # #;"1282771298528243712";https://twitter.com/mdeske/status/1282771298528243712
harry_caufield;2020-07-13 16:15;1;0;"Q for the panel: even just for COVID-19 documents, there's a lot of entity name variation and change in distribution over time. How to handle it? # ISMB2020 # textmining # NLP";;;# # #;"1282770741453189120";https://twitter.com/harry_caufield/status/1282770741453189120
harry_caufield;2020-07-13 16:13;0;1;"John Bachman (Harvard Med School) has a platform called EMMAA for examining integrated biomolecular models (and other models, too!) Here's the COVID-19 model: https://emmaa.indra.bio/dashboard/covid19?tab=model … # ISMB2020 # textmining # NLP";;;# # #;"1282770072486871040";https://twitter.com/harry_caufield/status/1282770072486871040
RGBerkson;2020-07-13 16:09;0;1;"Fantastic talk by @ k8hert on best-practice for teaching online. Lots of fantastic resources at https://carpentries.org/online-workshop-recommendations/ … # ISMB2020";;@;#;"1282769256996917249";https://twitter.com/RGBerkson/status/1282769256996917249
burkemlou;2020-07-13 16:09;1;15;"Excited to be joining # ISMB2020 and connecting with the community remotely! Come and chat with me about sharing training materials over tea and biscuits or other time zone appropriate snacks. https://twitter.com/EBItraining/status/1282654712827981824 …";;;#;"1282769123865317376";https://twitter.com/burkemlou/status/1282769123865317376
YiXing77;2020-07-13 16:06;0;3;"COSI hopping in # ISMB2020.";;;#;"1282768341569024001";https://twitter.com/YiXing77/status/1282768341569024001
nomad421;2020-07-13 16:05;0;0;"These are all in the @ iRnaCosi . The audio has been consistently smooth / working (except when there were problems on the machine doing the video playback). However, the video quality has ranged from “potato phone” to great.";;@;;"1282768189034815495";https://twitter.com/nomad421/status/1282768189034815495
YiXing77;2020-07-13 16:02;0;1;"The severity of this issue varies among different COSIs. Zoom has an option of downsampling image quality to preserve the smoothness of audio and video when doing screen sharing for playing a prerecorded video. Not sure if this is the culprit.";;;;"1282767423536594945";https://twitter.com/YiXing77/status/1282767423536594945
nomad421;2020-07-13 16:02;0;1;"It’s a broadcast of a previously recorded talk, I think that’s a key problem. I know that @ danfdeblasio was (sort of?) joking about optimizing compression artifacts, but there is certainly something going on. The slides now for the invited talk look great.";;@;;"1282767254011158529";https://twitter.com/nomad421/status/1282767254011158529
harry_caufield;2020-07-13 16:01;0;0;"Fabio Rinaldi ( @ fabiorinaldizh) is leading a project on analysis of COVID-19-related tweets https://pub.cl.uzh.ch/projects/COVID19/smm.html … # ISMB2020 # textmining # NLP";;@;# # #;"1282767213166915584";https://twitter.com/harry_caufield/status/1282767213166915584
GersteinLab;2020-07-13 16:01;0;0;"interesting talk by Ron Schwessinger at # MLCSB # ISMB2020 on predicting chromatin interaction using DNA sequence. pre-print: https://www.biorxiv.org/content/10.1101/724005v1 …";;;# #;"1282767170980773888";https://twitter.com/GersteinLab/status/1282767170980773888
cosi_sysmod;2020-07-13 16:00;1;5;"Matteo Barberis investigates cell cycle oscillations in yeast at @ UniSurreyBioSci and reports his dynamic model at SysMod / # ISMB2020. Their model identified the pivotal role of Clb3-centered regulations for autonomous oscillator designs by exploring the enormous parameter space.";;@;#;"1282766764171026434";https://twitter.com/cosi_sysmod/status/1282766764171026434
Magdoll;2020-07-13 15:58;0;0;"I'm watching the Alevin talk that is just happening now and it's painful. I basically rely on listening to what he's saying but the slides are a total blur";;;;"1282766330899206144";https://twitter.com/Magdoll/status/1282766330899206144
harry_caufield;2020-07-13 15:53;0;0;"Tonia Korvis (MITRE) presents a platform for exploring documents about SARS-CoV-2 therapeutics - see it at https://covidtib.c19hcc.org/ # ISMB2020 # textmining # NLP";;;# # #;"1282765090438053888";https://twitter.com/harry_caufield/status/1282765090438053888
rachaelevelyn;2020-07-13 15:52;11;22;"I will shortly be delivering a talk at # ISMB2020 (WEB track) on Best Practices in Online Training: @ SoftwareSaved's Experiences and Lessons Learned. Presentation slides on @ figshare:https://doi.org/10.6084/m9.figshare.12631118 …";;@ @;#;"1282764828088688648";https://twitter.com/rachaelevelyn/status/1282764828088688648
KrishnaswamyLab;2020-07-13 15:46;7;30;"Amazing week for science with both # ISMB2020 and # icml2020! So excited to see talks / posters from our lab by @ AlexanderTong7, @ egbert_castro, @ Pseudomanifold, and myself! Dates, titles, and links below";;@ @ @;# #;"1282763355846053889";https://twitter.com/KrishnaswamyLab/status/1282763355846053889
nomad421;2020-07-13 15:45;0;0;"No, Liz, you are not alone!";;;;"1282763151700885505";https://twitter.com/nomad421/status/1282763151700885505
Magdoll;2020-07-13 15:44;0;6;"Am I the only one suffering from resolution issues in # ISMB2020? I can't read the slides at all O_O!!! @ iscb";;@;#;"1282762967033896960";https://twitter.com/Magdoll/status/1282762967033896960
auslandcat;2020-07-13 15:44;2;2;"@ IAcornflake presenting on genomics and phenomics in crops in the Function track of # ISMB2020 , with an emphasis on predicting gene function and phenotype descriptions.";;@;#;"1282762796330098689";https://twitter.com/auslandcat/status/1282762796330098689
waldispuhl;2020-07-13 15:43;1;3;"The 2nd part of our special session about online # CitizenScience in Bioinformatics has started with @ eternagame @ Foldit @ stallcatchers @ microsetta ! # ismb2020";;@ @ @ @;# #;"1282762655997014016";https://twitter.com/waldispuhl/status/1282762655997014016
MelanieWeilert;2020-07-13 15:41;0;7;"Alex Tseng presented Fourier-based attributions to improve model interpretations of regulatory sequences—totally awesome! Look forward to using!! # ISMB2020";;;#;"1282762102143365121";https://twitter.com/MelanieWeilert/status/1282762102143365121
cosi_sysmod;2020-07-13 15:39;0;3;"Daniel Lobo from @ UMBC gives us a fascinating view of the world of planaria at SysMod / # ISMB2020. He explains how a self-regulated Turing system controls whole-body regeneration and size-dependent fission in these worms # sysbio";;@;# #;"1282761619509055491";https://twitter.com/cosi_sysmod/status/1282761619509055491
KariLavikka;2020-07-13 15:37;1;12;"# ISMB2020 started today! I'm presenting on Wednesday at the BioVis COSI. There's also a poster and a slightly shortened talk recording for ISMB registrants at https://iscb-ismb20.myconferencenow.com/poster/grammar-based-interactive-genome-visualization/ …https://twitter.com/KariLavikka/status/1261224242991050752 …";;;#;"1282761146311872512";https://twitter.com/KariLavikka/status/1282761146311872512
nomad421;2020-07-13 15:31;1;22;"Does anyone else find it very “meta” that # ISMB2020 is recording the sessions whose talks consist of recordings?";;;#;"1282759599733473281";https://twitter.com/nomad421/status/1282759599733473281
KrishnanLab;2020-07-13 15:21;6;22;"We are delighted to present 1 talk and 7 posters at @ iscb # ISMB2020! Do them out and send us your questions & comments. Thanks to @ NIH @ NIGMS & @ msuresearch for the funds that supported all this work.pic.twitter.com/wQNwy2qmZr";;@ @ @ @;#;"1282757174217912321";https://twitter.com/KrishnanLab/status/1282757174217912321
BrittanyABaur;2020-07-13 15:21;0;1;"Having a good time listening to talks at # ISMB2020 today. I really like the "my schedule" feature where I can add talks from all different tracks and hop into different zoom rooms throughout the day.";;;#;"1282757134535536642";https://twitter.com/BrittanyABaur/status/1282757134535536642
anaconesa;2020-07-13 15:17;4;23;"Thanks @ YosephBarash for your invitation to be keynote at the long reads @ iRnaCosi session today at # ISMB2020. Amazing session, great talks, awesome speakers. Loved the panel discussion on LRs for transcriptomics. Check out the # LRGASP challenge for more! https://www.gencodegenes.org/pages/lrgasp/";;@ @;# #;"1282755952199053313";https://twitter.com/anaconesa/status/1282755952199053313
lubianat;2020-07-13 15:12;0;1;"In 10 minutes, @ HWaymentSteele is presenting about the awesome Eterna game. If you are into RNA, you should definitely check https://eternagame.org/ # ISMB2020";;@;#;"1282754900406001669";https://twitter.com/lubianat/status/1282754900406001669
DMfun;2020-07-13 15:10;0;0;"Come attend our @ iscb # Ismb2020 work on an alignment-free Interpretable Deep Multiple Instance Learning (MIL) for predicting disease from whole-metagenomic data at 5:00 pm EST today here: https://iscb-ismb20.myconferencenow.com/#section-31-449 Paper: https://academic.oup.com/bioinformatics/article/36/Supplement_1/i39/5870478 … Code:https://github.com/mrahma23/IDMIL";;@;# #section;"1282754193384714243";https://twitter.com/DMfun/status/1282754193384714243
LuciaScience;2020-07-13 15:02;4;14;"# ISMB2020, come see our poster https://iscb-ismb20.myconferencenow.com/poster/epigenomic-enrichment-analysis-using-bioconductor/ … and let us know your thoughts. Great work by @ drighelli with @ drisso1893 @ timtriche and @ biobenkj";;@ @ @ @;#;"1282752216198045696";https://twitter.com/LuciaScience/status/1282752216198045696
cosi_sysmod;2020-07-13 14:58;1;4;"In her talk at SysMod / # ISMB2020, Yin Hoon Chew from @ IcahnMountSinai details how to reach the aim of building the first human whole-cell computer model for embryonic stem cells as a big step for personalized medicine. # sysbio @ wholecellmodels";;@ @;# #;"1282751278020534272";https://twitter.com/cosi_sysmod/status/1282751278020534272
waldispuhl;2020-07-13 14:55;0;0;"And now @ rsarrazing from @ phyloDNApuzzles ! # ismb2020 special session 2";;@ @;#;"1282750578846846976";https://twitter.com/waldispuhl/status/1282750578846846976
rtraborn;2020-07-13 14:51;0;1;". @ 3rdreviewer just gave a nice review of the results (and reactions to) his 2011 ortholog conjecture paper. Now moving into he and his colleagues' most recent analysis: https://journals.plos.org/ploscompbiol/article?id=10.1371/journal.pcbi.1002073#abstract1 … # ISMB2020 pic.twitter.com/NXoH4lcMQm";;@;#abstract1 #;"1282749466513039360";https://twitter.com/rtraborn/status/1282749466513039360
trang1618;2020-07-13 14:48;1;9;"In undergrad, I once had to manually go through ~ 3000 drug misspellings and fix them. TIL there's a lexicon of misspellings and synonyms for all of them . # ISMB2020 HT @ lavertu_adam @ Rbaltman https://doi.org/10.1016/j.jbi.2019.103307 …";;@ @;#;"1282748736951799809";https://twitter.com/trang1618/status/1282748736951799809
beagj;2020-07-13 14:37;2;6;"Excited talk by Prof. Douglas A. Lauffenburger: Translation between computational models, to humanize model, better than to apply model from a different spcies # ISMB2020 @ cosi_sysmodpic.twitter.com/ZwLqP1E35X";;@;#;"1282746001829363712";https://twitter.com/beagj/status/1282746001829363712
waldispuhl;2020-07-13 14:36;0;0;"And now Ginger Tsueng from @ Mark2Cure! # ISMB2020 special session #2.";;@;# #2;"1282745656201883652";https://twitter.com/waldispuhl/status/1282745656201883652
cosi_sysmod;2020-07-13 14:29;1;11;"Many thanks to Doug Lauffenburger from @ MIT for presenting a keynote talk at SysMod / # ISMB2020! We learned how computational models could cross species boundaries and how applying neural network methods can guide our understanding of disease states. # sysbiopic.twitter.com/ZniI8d5nle";;@;# #;"1282743981521199112";https://twitter.com/cosi_sysmod/status/1282743981521199112
Jordan_T_Bird;2020-07-13 14:29;0;1;"Attending # ISMB2020 virtually this week. Watching @ 3rdreviewer give us the scope on orthologs and paralogs.";;@;#;"1282743937376165895";https://twitter.com/Jordan_T_Bird/status/1282743937376165895
rtraborn;2020-07-13 14:27;1;6;"Really looking forward to @ 3rdreviewer's talk on his # ISMB2020 conference proceedings paper on the Ortholog Conjecture with @ pedjagogue and others.https://www.biorxiv.org/content/10.1101/2019.12.27.889691v1 …";;@ @;#;"1282743493325029376";https://twitter.com/rtraborn/status/1282743493325029376
Milana_FM;2020-07-13 14:24;0;3;"@ Alfons_Valencia hope we have a freeeeeely available zoom link, right?";;@;;"1282742832642625536";https://twitter.com/Milana_FM/status/1282742832642625536
moorejh;2020-07-13 14:23;1;6;"Be sure and follow the # ISMB2020 hashtag for great tweets from the 2020 Intelligent Systems for Molecular Biology (ISMB) conference. # bioinformatics # genomics";;;# # #;"1282742531676082177";https://twitter.com/moorejh/status/1282742531676082177
waldispuhl;2020-07-13 14:20;0;0;"Seth Cooper is now speaking of @ Foldit and its history at our Special Session #2 at # ISMB2020. Join us now!";;@;#2 #;"1282741724511481856";https://twitter.com/waldispuhl/status/1282741724511481856
quaidmorris;2020-07-13 14:19;2;27;"Please join us tomorrow at # ISMB2020 at 3:40 PM (EDT) when @ lsunderm will give a talk: Reconstructing Tumor Evolutionary Histories and Clone Trees in Polynomial-time with SubMARine in the Evolution and Comparative Genomics track. joint work w/ @ gxr, @ jwintersinger, J Stoyepic.twitter.com/hQgMLxX1wI";;@ @ @;#;"1282741539035402241";https://twitter.com/quaidmorris/status/1282741539035402241
k3yavi;2020-07-13 14:08;6;22;"Our work "A Bayesian framework for inter-cellular information sharing improves dscRNA-seq quantification" is now published at # Bioinformatics , a proceedings talk happening today 3:40 PM EDT on iRNA cosi of # ISMB2020. https://academic.oup.com/bioinformatics/article/36/Supplement_1/i292/5870502 …";;;# #;"1282738647985467395";https://twitter.com/k3yavi/status/1282738647985467395
GersteinLab;2020-07-13 14:03;1;0;"# ISMB2020 # MLCSB afternoon session starts with a keynote by @ anshulkundaje on deep learning for cis-regulatory motif syntax";;@;# #;"1282737375534297088";https://twitter.com/GersteinLab/status/1282737375534297088
melikedonertas;2020-07-13 14:00;4;12;"still upsetting but thanks to being a virtual event # SCS2020 allowed us to meet amazing colleagues. these cannot replace in-person meetings but we hope to expand our network through future virtual events, like the @ iscbsc # webinar initiative http://iscbsc.org/webinars # ISMB2020 https://twitter.com/JamesBaker_biol/status/1282731690419421188 …";;@;# # #;"1282736619913699329";https://twitter.com/melikedonertas/status/1282736619913699329
YichenZhang15;2020-07-13 13:59;1;2;"Excited to talk about our work tomorrow in # ISMB2020, # MLCSB, Machine Learning in Computational and Systems Biology. Check it out if you are interested! https://www.iscb.org/ismb2020 pic.twitter.com/k1ELIISEe3";;;# #;"1282736488392753152";https://twitter.com/YichenZhang15/status/1282736488392753152
metricausa;2020-07-13 13:59;0;1;"Offsetting carbon footprint is not the first choice, says Bateman, it would be better to reduce ISCB's carbon footprint, which they are also setting out to do. The trees, by the way, are native trees and the grove is in Scotland. # ISMB2020";;;#;"1282736449641746434";https://twitter.com/metricausa/status/1282736449641746434
dr_zeeshanahmed;2020-07-13 13:57;1;2;"Representing @ rutgersifh, looking forward to participate and present at the 28th International Conference on Intelligent Systems for Molecular Biology (ISMB-2020) by @ iscb pic.twitter.com/hNeh0Gpaoi";;@ @;;"1282736009151733762";https://twitter.com/dr_zeeshanahmed/status/1282736009151733762
metricausa;2020-07-13 13:56;0;3;"# ISMB2020 Trees, and not the computational kind. Alex Bateman talks about the ISCBGrove set up to offset carbon footprint with UK charity All Things Small and Green . Donors can donate trees. The grove is in Scotland http://treesforlife.org.uk/groves/206760/ 1/2";;;#;"1282735566199693312";https://twitter.com/metricausa/status/1282735566199693312
CATH_Gene3D;2020-07-13 13:50;8;6;"The Fun with FunFams(!) is not over yet at # ISMB2020! Tomorrow at 2.20pm EDT for a talk by Christine Orengo on # CATH approaches for # CAFA4. Interesting talk (S.Lam) on # SARSCoV2 host range - # 3DSIG track at 11.20pm. CATH collab with # Aquaria at 5.45pm on # COVID19 track.";;;# # # # # # #;"1282734107223564289";https://twitter.com/CATH_Gene3D/status/1282734107223564289
duyguucar;2020-07-13 13:44;1;5;"Join us the in afternoon for more talks on Systems immunology, co-organized with @ ferhatay, # ISMB2020 https://www.iscb.org/cms_addon/conferences/ismb2020/tracks/sst01 …";;@;#;"1282732538755035136";https://twitter.com/duyguucar/status/1282732538755035136
JamesBaker_biol;2020-07-13 13:40;1;8;"Great data from @ melikedonertas at # ISMB2020 about how many attendees could not attend the conference unless it was virtual! What a positive spin on a situation most people describe as a problematic issue!";;@;#;"1282731690419421188";https://twitter.com/JamesBaker_biol/status/1282731690419421188
gamzeandgursoy;2020-07-13 13:40;0;2;"# ISMB2020 Really love the representation from Europe and Asia. I keep seeing familiar names that I used to see when I attend # ECCB. Looking forward to see this year's conference stats...";;;# #;"1282731608747978758";https://twitter.com/gamzeandgursoy/status/1282731608747978758
larsjuhljensen;2020-07-13 13:38;0;15;"Wondering how many # ISMB2020 presenters are currently busy uploading their original presentation recordings as private videos to YouTube to be able to share a link to the presentation in better quality, when their talk comes up ...";;;#;"1282731209051832320";https://twitter.com/larsjuhljensen/status/1282731209051832320
P_Palagi;2020-07-13 13:30;1;5;"The Workshop for Education in Bionformatics (WEB) will start in 30’ in the # ISMB2020 @ iscb conference. Make yourself comfortable and join us ! https://twitter.com/P_Palagi/status/1282357637678587904 …";;@;#;"1282729179532926976";https://twitter.com/P_Palagi/status/1282729179532926976
JeneaIA;2020-07-13 13:28;0;4;"Tremendous programming underway at # ISMB2020—so many attendees, lots of interesting topics, many ways to interact and network. I’m really enjoying my first # ISMB experience even it’s virtual (imagining myself in Montreal in the meantime)";;;# #;"1282728661934837766";https://twitter.com/JeneaIA/status/1282728661934837766
gjbarton;2020-07-13 13:26;3;4;"Geat to hear at # ISMB2020 about ISCB Grove for CO2 offset. If you are a computational biologist then why not buy trees in Scotland to offset your carbon emissions? You don't have to be CB to do this @ UoDLifeSciences ! Thanks @ Alexbateman1 and othershttps://bit.ly/38PK2Sf";;@ @;#;"1282728077500481542";https://twitter.com/gjbarton/status/1282728077500481542
jmschreiber91;2020-07-13 13:22;1;31;"The # ISMB2020 # MLCSB COSI is off to a great start so far! Interesting talks from @ OliverStegle, Yang Zhang, and Aayush Grover. After the break is @ anshulkundaje, whose talk I'll probably skip because his work is generally boring.";;@ @;# #;"1282727021789868037";https://twitter.com/jmschreiber91/status/1282727021789868037
iddux;2020-07-13 13:20;5;5;"Do you know what phenomics is? What do you mean "no"? Tune in to our keynote @ IAcornflake today at 3:20 US Eastern Channel 2 "Saving Time at the Bench and in the Field: Predicting Gene Function and Phenotype in Crops" # ISMB2020";;@;#;"1282726492326125568";https://twitter.com/iddux/status/1282726492326125568
StructBioinfo;2020-07-13 13:18;0;2;"Please stop by his poster at # ISMB2020 @ BiotechSASTRA1 @ RajanSekar1 @ SastraUniv @ ShivNadarUniv # excitedhttps://twitter.com/SankarMaheshR/status/1282691179964960768 …";;@ @ @ @;# #;"1282726072908423170";https://twitter.com/StructBioinfo/status/1282726072908423170
Victoria_L_A;2020-07-13 13:14;0;6;"So many intereating talks on # ISMB2020! I'm happy that @ iscb decided to go virtual this year, otherwise I wouldn't have been able to attend. And special thanks to @ AleMedinaRivera for giving me the opportunity to attend the conference as part of her lab THANK YOU!!!";;@ @;#;"1282724977377255427";https://twitter.com/Victoria_L_A/status/1282724977377255427
metricausa;2020-07-13 13:12;0;6;"# ISMB2020 new OA journal forthcoming. Bioinformatics Advances with Oxford University Press, says ISCB president Thomas Lengauer";;;#;"1282724482961100802";https://twitter.com/metricausa/status/1282724482961100802
drsbello;2020-07-13 13:11;0;2;"# ISMB2020 Congratulations @ jb2270 on being an ISCB 2020 Fellow!pic.twitter.com/OoZUxhHXaZ";;@;#;"1282724256476954625";https://twitter.com/drsbello/status/1282724256476954625
sue_ann_krause;2020-07-13 13:04;1;5;"Our work - endless hours of fly dissections (& more to come) - a great platform to show the tissue specific metabolites by @ kmcluskey. # ISMB2020 # drosophila # metabolomics http://FlyMet.org https://twitter.com/kmcluskey/status/1282705327063011329 …";;@;# # #;"1282722534023200768";https://twitter.com/sue_ann_krause/status/1282722534023200768
stallcatchers;2020-07-13 13:00;1;1;"So excited to be part of it! # ISMB2020 https://twitter.com/waldispuhl/status/1282698231760277506 …";;;#;"1282721563184332804";https://twitter.com/stallcatchers/status/1282721563184332804
Annhled6;2020-07-13 12:56;0;2;"Totally agreed @ JamesBaker_biol it's my first # ISMB2020 so I'm beyond thrilled and excited";;@;#;"1282720543540760576";https://twitter.com/Annhled6/status/1282720543540760576
selcan_t;2020-07-13 12:54;1;4;"There are so many multi-omics papers with many cell types from many tissues/individuals etc. Then I see DEgenes in those papers and a referral to DESEQ2 or limma but no linear models. 1/2 # Rstats # AcademicChatter # ISMB2020";;;# # #;"1282720125985132544";https://twitter.com/selcan_t/status/1282720125985132544
fpozoca;2020-07-13 12:47;4;15;"Exciting experience attending # ISMB2020 in Montreal, from Spain. If you are curious about the functional importance of splice isoforms, you can find "TRIFID: Determining Functional Isoforms" in the poster session of the 826 EvoCompGen COSI: https://iscb-ismb20.myconferencenow.com/poster/trifid-determining-functional-isoforms/ …pic.twitter.com/Pbgj2Is3gn";;;#;"1282718263185600512";https://twitter.com/fpozoca/status/1282718263185600512
beagj;2020-07-13 12:46;0;8;"Huge and great schedule # ISMB2020! Difficult to choose among simultaneous talks, today between # MLCSB and @ cosi_sysmod. Lucky we could see the pending recorded talk later. Happy to virtually attend!";;@;# #;"1282718163822686209";https://twitter.com/beagj/status/1282718163822686209
iddux;2020-07-13 12:43;0;0;"@ nicolabordin on the value of CAFA to understand accuracy of annotations in model organisms # ISMB2020";;@;#;"1282717296075522048";https://twitter.com/iddux/status/1282717296075522048
cosi_sysmod;2020-07-13 12:42;1;11;"We thank @ pf_mg from @ McGillUPhysics for the excellent 1st keynote talk at # ISMB2020 about his work in collaboration with @ NIH with beautiful animations and videos, bridging interdisciplinary fields: robotic mapping and modeling of Cytokine dynamics also concerning # COVID19.pic.twitter.com/kXB8NWahNg";;@ @ @;# #;"1282716984132734976";https://twitter.com/cosi_sysmod/status/1282716984132734976
Annhled6;2020-07-13 12:36;0;4;"Thankfully talks will be recorded so we can catch up later with those that overlap # ISMB2020";;;#;"1282715536917487616";https://twitter.com/Annhled6/status/1282715536917487616
blucher_a;2020-07-13 12:33;1;3;"First proceedings talk at # MLCSB # ISMB2020 was on MutSpace by @ zocean636 @ jmuiuc - patient-specific embeddings of somatic mutation signatures, link to paper below. Adding to read-list along with all the great refs from Tutorial1 (mutational signatures) this weekend!!https://twitter.com/jmuiuc/status/1282676717702844417 …";;@ @;# #;"1282714766503337989";https://twitter.com/blucher_a/status/1282714766503337989
vickyhellon;2020-07-13 12:31;0;2;"@ robert_leaman giving a great talk on the variance in terms, acronyms and more that authors use that can hinder automated text analysis. COVID-19 a great example of this! # ismb2020 pic.twitter.com/3D7xo43545";;@;#;"1282714283453931520";https://twitter.com/vickyhellon/status/1282714283453931520
mkuijjer;2020-07-13 12:21;0;2;"nice talk at # ISMB2020, thanks for sharing your slides";;;#;"1282711658645856262";https://twitter.com/mkuijjer/status/1282711658645856262
