username;date;retweets;favorites;text;geo;mentions;hashtags;id;permalink
BioinfoRajput;2020-07-20 14:31;0;1;"Congrats Prash";;;;"1285281074545700864";https://twitter.com/BioinfoRajput/status/1285281074545700864
angifeldmann;2020-07-20 11:52;0;1;"Congrats, Robert!";;;;"1285241268436705282";https://twitter.com/angifeldmann/status/1285241268436705282
JinhCho10;2020-07-20 11:50;0;1;"Congrats Robert and the team!";;;;"1285240785307422720";https://twitter.com/JinhCho10/status/1285240785307422720
EdwardLBraun1;2020-07-20 11:35;0;3;"Congratulations to the award winners (and all presenters!) at the very successful virtual # ISMB2020 meeting https://twitter.com/janani137/status/1284645356693848064 …";;;#;"1285236943295590402";https://twitter.com/EdwardLBraun1/status/1285236943295590402
prashbio;2020-07-20 11:34;1;18;"Just delivered a keynote on Open minds bring open # collaborations. Thank you @ DrGPrice @ tnabtaf @ OBF_BOSC @ galaxyproject @ GalaxyAustralia @ bioclues @ APBioNetorg @ iscb A great conferencing experience - # BCC2020 @ bioinformatics # systemsgenomics # biology # events # convergencepic.twitter.com/8VLT9ukybb";;@ @ @ @ @ @ @ @ @;# # # # # #;"1285236626436702208";https://twitter.com/prashbio/status/1285236626436702208
iRnaCosi;2020-07-20 10:50;0;2;"Tomorrow 11am EDT: a platform that expands the scope of phenotypes used in # CRISPRscreens (think subcell localization/density/morphology). Recently out in @ naturemethods the paper also finds modifiers of # StressGranules. Registration: https://iscb.swoogo.com/iscbacademy-10-wheeler … @ RNASociety @ iscb";;@ @ @;# #;"1285225610223276041";https://twitter.com/iRnaCosi/status/1285225610223276041
PfeiferLab;2020-07-20 10:45;1;8;"While reflecting on the many interesting ideas from # ICML2020 and # ISMB2020, this week we # cantwait to enjoy our @ ml4science's Virtual Cluster Conference "Machine Learning in Science" # ml4science2020! # MedicalInformatics # MachineLearning https://uni-tuebingen.de/en/research/core-research/cluster-of-excellence-machine-learning/events/events/#c1124370 …";;@;# # # # # # #c1124370;"1285224378268028929";https://twitter.com/PfeiferLab/status/1285224378268028929
robertietswaart;2020-07-20 10:20;4;23;"Thank you @ ISCB for selecting GeneWalk for the Student Software Prospective Future Impact Award! https://www.iscb.org/iscb-news-items/4456-2020-july13-ismb2020-day01-highlights-recap … I feel grateful for this recognition and encouragement. Wouldn’t be here without co-developers @ benjamingyori @ johnabachman, Peter Sorger and mentor @ fiddle!pic.twitter.com/aOGKhx6xNF";;@ @ @ @;;"1285217951080165379";https://twitter.com/robertietswaart/status/1285217951080165379
ycuestaastroz;2020-07-20 10:15;0;5;"Great talk and poster presentations. Congrats!!";;;;"1285216743066079234";https://twitter.com/ycuestaastroz/status/1285216743066079234
stevetsa1;2020-07-20 10:15;0;0;"@ bioclues is a non-profit organization Of, By, and For the # Bioinformaticians in India. An affiliate of @ ISCB http://bioclues.org/ # mentoring # outreach # research # entrepreneurship";;@ @;# # # # #;"1285216684937285633";https://twitter.com/stevetsa1/status/1285216684937285633
F1000Research;2020-07-20 10:03;0;3;"It was a great to meet so many # bioinformatics researchers at # ISMB2020! But don't worry if you didn’t get a chance to talk to us – you can find out more about publishing your # softwaretool article in the @ ISCB Community Journal here: https://buff.ly/3gZWH7I pic.twitter.com/gX4nFmikVq";;@;# # #;"1285213637255352325";https://twitter.com/F1000Research/status/1285213637255352325
Gabo_NPs;2020-07-20 09:59;0;3;"Don't miss it!";;;;"1285212730249666560";https://twitter.com/Gabo_NPs/status/1285212730249666560
pouryany;2020-07-20 08:17;0;4;"# ISMB2020 was an interesting experience being my first online conference and kudos to the organizer for doing a great job, especially # NetBio. Many have correctly pointed out improvements for online venues, but there are positive aspects that should not go unmentioned (1/5)";;;# #;"1285187195687632896";https://twitter.com/pouryany/status/1285187195687632896
propicee;2020-07-20 05:53;4;9;"A nice write-up from # SCS2020 co-chair @ melikedonertas regarding organising virtual symposium. # ISMB2020 # bioinformatics # computationalbiology # virtual # virtualconference # symposiahttps://twitter.com/melikedonertas/status/1284394524522024960 …";;@;# # # # # # #;"1285150709051199490";https://twitter.com/propicee/status/1285150709051199490
escs2020;2020-07-20 05:36;9;10;">> Deadline TODAY (23.59 CET) !!! Dear Students/ECRs, Do not miss this excellent opportunity to submit your latest research ( # Bioinformatics # ComputationalBiology) to # ESCS2020 Submission: https://escs2020.iscbsc.org/abstract-submission … @ iscbsc @ eccb2020 @ iscb # eccb2020pic.twitter.com/Wo0UJq5wJZ";;@ @ @;# # # #;"1285146433872711680";https://twitter.com/escs2020/status/1285146433872711680
CIMethods;2020-07-20 05:02;2;3;"CIM academic @ cagatay_turkay co-chaired this year’s # BioVis conference at # ISMB2020. The programme (http://biovis.net/2020/program_ismb/ …) featured great examples of # datavisualization for biology and the talks will soon be published on ISMB’s channel here:https://www.youtube.com/channel/UCN9kqT7pfOzZddPJHqWSuyA …";;@;# # #;"1285138017213198336";https://twitter.com/CIMethods/status/1285138017213198336
olgavitek;2020-07-20 00:53;2;12;"Clinical # MSImaging of tissues often has imprecise pathology annotations. The new method Dan Guo and @ MCFoell develops pixel-level classifiers from such imprecisely annotated tissues. The # ismb2020 manuscript is now open access at https://academic.oup.com/bioinformatics/article/36/Supplement_1/i300/5870486 …";;@;# #;"1285075266985959425";https://twitter.com/olgavitek/status/1285075266985959425
threadreaderapp;2020-07-19 19:37;0;0;"Hello, you can read it here: @ larsjuhljensen: Having survived # ISMB2020, and having experienced a bit of # ASMS2020 and # RECOMB2020 too, it's time… https://threadreaderapp.com/thread/1284433492445667329.html … See you soon.";;@;# # #;"1284995741656780800";https://twitter.com/threadreaderapp/status/1284995741656780800
escs2020;2020-07-19 06:47;5;5;">> Deadline TOMORROW i.e., 20th July! # ESCS2020 Submission: https://escs2020.iscbsc.org/abstract-submission … # Bioinformatics # ComputationalBiology @ iscbsc @ eccb2020 @ iscb # eccb2020https://twitter.com/escs2020/status/1283686998184779776 …";;@ @ @;# # # #;"1284802113890127873";https://twitter.com/escs2020/status/1284802113890127873
ANarunsky;2020-07-18 21:57;0;1;"Congratulations! It was a great talk indeed!";;;;"1284668730782486531";https://twitter.com/ANarunsky/status/1284668730782486531
janani137;2020-07-18 20:24;6;7;"Thoroughly enjoyed the # EvolCompGen COSI & # ISMB2020 Hearty Congratulations to the Talk & Poster awardees @ EvolComp Talk Winner - @ AvitalSharir Poster Winner - Linda Sundermann @ lsunderm Poster Special Mentions - Xuecong Fu - @ KJongnarangsin - @ GurmeetKaur86 - Samuel Chenpic.twitter.com/lHbltUUVLo";;@ @ @ @ @;# #;"1284645356693848064";https://twitter.com/janani137/status/1284645356693848064
AvitalSharir;2020-07-18 19:31;0;1;"Congratulations!";;;;"1284632000515788803";https://twitter.com/AvitalSharir/status/1284632000515788803
AvitalSharir;2020-07-18 19:29;1;6;"Had a wonderful time attending the virtual # ISMB2020 of @ iscb and very honored to receive the @ EvolComp best talk award! https://www.iscb.org/ismb2020-general/ismb2020-award-winners …pic.twitter.com/1XUfoSfIJB";;@ @;#;"1284631388130619392";https://twitter.com/AvitalSharir/status/1284631388130619392
winhide;2020-07-18 17:10;1;5;"We tried to share what we learned a long while back for virtual conferencing across Africa. Glad some of the suggestions from @ larsjuhljensen for # ISMB2020 have stood the time test. https://tinyurl.com/y6el9bg3 https://twitter.com/larsjuhljensen/status/1284433492445667329 …";;@;#;"1284596309652123648";https://twitter.com/winhide/status/1284596309652123648
Nonenty;2020-07-18 14:32;0;1;"Congratulations!";;;;"1284556677044482049";https://twitter.com/Nonenty/status/1284556677044482049
FattelLeila;2020-07-18 14:31;0;3;"I completely agree! I bet it wasn’t easy for the organizers of # ISMB2020 to make this conference virtual, and it exceeded my expectations. But a lot can be improved. I really hope both live and virtual aspects would be integrated in future conferences to become widely accessible.";;;#;"1284556482743328769";https://twitter.com/FattelLeila/status/1284556482743328769
weitinglin66;2020-07-18 10:10;0;2;"GenomeSpy, Grammar-Based Interactive Genome Visualization https://www.youtube.com/watch?v=7GanrFw7gJA … # ISMB2020 A GPU-based tool to visualize complex data with vega-lite API";;;#;"1284490737011224578";https://twitter.com/weitinglin66/status/1284490737011224578
Vikram_Alva;2020-07-18 08:21;0;1;"Congratulations, Aya!";;;;"1284463182984163328";https://twitter.com/Vikram_Alva/status/1284463182984163328
threadreaderapp;2020-07-18 08:12;0;0;"Hello, the unroll you asked for: @ larsjuhljensen: Having survived # ISMB2020, and having experienced a bit of # ASMS2020 and # RECOMB2020 too, it's time… https://threadreaderapp.com/thread/1284433492445667329.html … Have a good day.";;@;# # #;"1284461090299088896";https://twitter.com/threadreaderapp/status/1284461090299088896
arunprasad_p;2020-07-18 07:38;1;1;"Many congratulation to @ StevenSalzberg1 for the @ iscb accomplishments by a Senior Scientist Award 2020! Thanks for your excellent keynote on Bioinformatics and Genomics. # ISMB2020 # Genomics # Bioinformaticshttps://twitter.com/StevenSalzberg1/status/1283907461183873027 …";;@ @;# # #;"1284452507390029824";https://twitter.com/arunprasad_p/status/1284452507390029824
egonwillighagen;2020-07-18 07:28;0;0;"# ISMB2020 in that sense was not helping: I already worked a day, and then the conference started late afternoon :( Online: back-to-back means 24/7 :/";;;#;"1284449942417833984";https://twitter.com/egonwillighagen/status/1284449942417833984
iddux;2020-07-18 07:27;0;1;"# ismb2020 talks will go on the # iscb YouTube channel for those who authorized a CC license. An initial conference presentation helps you to reach a captive "target audience" which is there specifically to hear you.";;;# #;"1284449812000264192";https://twitter.com/iddux/status/1284449812000264192
larsjuhljensen;2020-07-18 06:39;0;23;"Pre-recorded short presentations by poster presenters worked much better than the actual posters. However, they should be short! The 3 minutes at # ASMS2020 was great. The 7 minutes at # ISMB2020 was way too much given the number of posters. 7/n";;;# #;"1284437720891367425";https://twitter.com/larsjuhljensen/status/1284437720891367425
larsjuhljensen;2020-07-18 06:32;1;6;"A web interface like the one at # ISMB2020, which shows a thumbnail of the poster and the name of the presenter, doesn't cut it. You cannot see anything from the thumbnail, and you don't know most of the presenters yet. You thus have to open poster to see just what it is. 4/n";;;#;"1284435898986377218";https://twitter.com/larsjuhljensen/status/1284435898986377218
larsjuhljensen;2020-07-18 06:23;31;115;"Having survived # ISMB2020, and having experienced a bit of # ASMS2020 and # RECOMB2020 too, it's time for me to reflect on what I think works at virtual conferences and what doesn't. 1/n";;;# # #;"1284433492445667329";https://twitter.com/larsjuhljensen/status/1284433492445667329
tsonika;2020-07-18 05:14;4;25;"this is hilarious! by @ rafalab :D @ iscb # ISMB2020 pic.twitter.com/zDXW1db1Td";;@ @;#;"1284416295589392384";https://twitter.com/tsonika/status/1284416295589392384
VickyNembaware;2020-07-18 04:44;0;0;"A pity could not attend this year. Count me in for next year!";;;;"1284408715588907008";https://twitter.com/VickyNembaware/status/1284408715588907008
DolorsVaqu;2020-07-18 02:28;0;1;"Congrats Ina";;;;"1284374501770301440";https://twitter.com/DolorsVaqu/status/1284374501770301440
FairlieReese;2020-07-17 21:24;3;7;"A little late but I really enjoyed my time at # ismb2020 this year! If you attended but didn't check out my talk or poster about my Python library for visualizing and analyzing long-read transcriptomes, you can still check them out! https://flash.performedia.com/2020/iscb/ismb2020/pre-recorded-talks/mp4/Fairlie_Reese_-_200619_swan_ismb.mp4 … https://iscb-ismb20.myconferencenow.com/poster/swan-a-python-library-for-the-analysis-and-visualization-of-long-read-transcriptomes/ …";;;#;"1284298014824095744";https://twitter.com/FairlieReese/status/1284298014824095744
jzahratk;2020-07-17 20:14;0;1;"Saw the talk associated with this preprint at # ISMB2020, it's super cool! Check it out! https://twitter.com/biorxiv_bioinfo/status/1284265689080049664 …";;;#;"1284280298960756741";https://twitter.com/jzahratk/status/1284280298960756741
propicee;2020-07-17 19:37;0;2;"Congratulations @ ina_deutschmann";;@;;"1284271114869506056";https://twitter.com/propicee/status/1284271114869506056
chaichoompu;2020-07-17 19:18;0;1;"Congratulations";;;;"1284266208716562435";https://twitter.com/chaichoompu/status/1284266208716562435
iddux;2020-07-17 14:25;0;5;"After # ISMB2020 this article by @ winhide and colleagues on how to organize a virtual conference is particularly topical. Note the date.https://journals.plos.org/ploscompbiol/article?id=10.1371/journal.pcbi.1000650 …";;@;#;"1284192582801776640";https://twitter.com/iddux/status/1284192582801776640
fabian_theis;2020-07-17 13:24;0;1;"Congrats, Yannik!";;;;"1284177116737806340";https://twitter.com/fabian_theis/status/1284177116737806340
vedantchandra;2020-07-17 13:21;0;1;"Congratulations!";;;;"1284176413004828672";https://twitter.com/vedantchandra/status/1284176413004828672
eccb2020;2020-07-17 13:17;0;1;"Hi Cristal! All the information regarding the @ iscb registration fellowship is available here: https://eccb2020.info/attendance-waiver-fellowship/ …";;@;;"1284175368556032002";https://twitter.com/eccb2020/status/1284175368556032002
OrbachRon;2020-07-17 12:48;0;1;"Well done Aya I really enjoyed the poster";;;;"1284168087961513984";https://twitter.com/OrbachRon/status/1284168087961513984
JRaviLab;2020-07-17 12:42;2;8;"We just had a fantastic conference # ISMB2020 @ iscb And some great news to go with it: @ KJongnarangsin & Samuel Chen received honorable mentions for their posters in the @ EvolComp track! Hearty congratulations! https://www.iscb.org/ismb2020-general/ismb2020-award-winners#evo-special … @ UR_at_MSU @ msuresearch @ msuvetshttps://twitter.com/JRaviLab/status/1282645741845073921 …";;@ @ @ @ @ @;# #evo;"1284166496827117569";https://twitter.com/JRaviLab/status/1284166496827117569
ANarunsky;2020-07-17 12:25;2;7;"Had a great time at @ iscb # ISMB2020! You can check out my poster (on a work previously published in @ PNASNews: https://www.pnas.org/content/117/9/4701 …), which was awarded the RCSB and PDB @ buildmodels poster prize! http://www.cs.haifa.ac.il/~trachel/71_Narunsky_Aya_3DSIG.mp4 …";;@ @ @;#;"1284162272529719298";https://twitter.com/ANarunsky/status/1284162272529719298
egonwillighagen;2020-07-17 11:18;0;0;"@ ICSB, so, I release my presentation video under a CC-BY. Is there going to be a # ISMB2020 channel somewhere, where you will host all the video's? Should I upload them this weekend myself?";;@;#;"1284145399918465024";https://twitter.com/egonwillighagen/status/1284145399918465024
AleMedinaRivera;2020-07-17 10:43;1;5;"Remember posters will be available for on demand and you can always contact the author through the system # ISMB2020 # RegSys2020 ProTip: subscribe to the posters you like to get notifications from author's answershttps://twitter.com/manusaraswat10/status/1283870260471291904 …";;;# #;"1284136612818034697";https://twitter.com/AleMedinaRivera/status/1284136612818034697
yannik_schaelte;2020-07-17 10:35;1;28;"I feel very honored to receive the Ian Lawson Van Toch Memorial Award for Outstanding Student Paper. Especially I find the story behind the award really inspiring. Thank you to the family of Ian, the funders, the committee, and my supervisor @ JanHasenauer + lab! @ iscb # ismb2020 https://twitter.com/JanHasenauer/status/1284017251792846848 …";;@ @;#;"1284134567339855872";https://twitter.com/yannik_schaelte/status/1284134567339855872
mattmyers_cb;2020-07-17 09:54;3;3;"Happy to present this work applying SBMs to sparse mutations from single-cell tumor data. Please check out the open-access paper (https://bit.ly/3jecz8M ) and the code (https://bit.ly/3h4w3us ). # hitseq2020 # ISMB2020 https://twitter.com/HiTSeq/status/1283799216821854210 …";;;# #;"1284124315680636929";https://twitter.com/mattmyers_cb/status/1284124315680636929
StevenSalzberg1;2020-07-17 08:13;0;0;"if you registered for the conference, all talks will be made available for viewing through the end of October. Not sure if post-registration is possible but contact @ iscb";;@;;"1284098959217131522";https://twitter.com/StevenSalzberg1/status/1284098959217131522
SiumSyed;2020-07-17 07:37;1;7;"@ iscb @ iscbsc showed the path to arrange a successful conference virtually. Organizers might think of a hybrid conference from now on! Thus a large number of people can also join from developing and underdeveloped nations. Hope to join # ISMB2021 at Lyon, France!";;@ @;#;"1284089731240783872";https://twitter.com/SiumSyed/status/1284089731240783872
tsonika;2020-07-17 06:40;0;4;"Catching up on the backlog of # ISMB2020 talks. An absolutely delightful talk by @ WyWyWa on "Detection of functional cis-regulatory variations causal for rare genetic disorders "pic.twitter.com/NMeWunmLlP";;@;#;"1284075379901095936";https://twitter.com/tsonika/status/1284075379901095936
m4ri4pch;2020-07-17 06:07;0;0;"Congrats @ loucerac !";;@;;"1284067293002113027";https://twitter.com/m4ri4pch/status/1284067293002113027
m4ri4pch;2020-07-17 06:06;0;0;"Thank you! All the presentations were awesome It's been my first CAMDA, and it was a really great experience. I hope I can join next editions! And enjoy local cuisine";;;;"1284066916970233856";https://twitter.com/m4ri4pch/status/1284066916970233856
ina_deutschmann;2020-07-17 05:34;4;39;"I feel honored, grateful, and very happy that my poster won an award at the # ISMB2020 # NetBio COSI and # SCS2020 https://twitter.com/ProfMilenkovic/status/1283914567270227973 …pic.twitter.com/YVYQ6JQ3ff";;;# # #;"1284058984882806786";https://twitter.com/ina_deutschmann/status/1284058984882806786
monzon_vivian;2020-07-17 04:38;3;10;"Great talks from @ Alexbateman1 , @ hpcprogrammer and @ minouye271 at the Green session at # ISMB2020. Looking forward to improve my work by computing greener with the help of http://green-algorithms.org (http://arxiv.org/abs/2007.07610 )!";;@ @ @;#;"1284044712555552769";https://twitter.com/monzon_vivian/status/1284044712555552769
egonwillighagen;2020-07-17 03:09;0;1;"I have asked if/when I can post my # ISMB2020 slides and presentation video online. Not sure sure.";;;#;"1284022316029095939";https://twitter.com/egonwillighagen/status/1284022316029095939
molsysbio;2020-07-17 02:23;1;7;"Congratulations to Torsten: received the best talk award in the # NetBio track at # ISMB2020 ! pic.twitter.com/aMI2zT4HgM";;;# #;"1284010864970993664";https://twitter.com/molsysbio/status/1284010864970993664
ANUJSIN64421818;2020-07-16 23:18;0;1;"I had my life's first conference poster presentation and it was # ISMB2020. 2ndly, it was also first ISMB participation from my institute. It's an amazing feeling I never felt and want to thank ISMB team for such a great opportunity. One step forward for grad school application pic.twitter.com/EBUHO6EA8M";;;#;"1283964165103607809";https://twitter.com/ANUJSIN64421818/status/1283964165103607809
maththrills;2020-07-16 23:14;0;0;"Congrats @ dperrin";;@;;"1283963290477985793";https://twitter.com/maththrills/status/1283963290477985793
computbiolgeek;2020-07-16 20:46;0;0;"Maybe a virtual part can be added in future in-person conferences for those who want to attend but could not make it due to travel restrictions # ISMB2020.";;;#;"1283925966201528320";https://twitter.com/computbiolgeek/status/1283925966201528320
computbiolgeek;2020-07-16 20:46;0;1;"I'm among those who couldn't have made it in person due to visa restrictions. Thanks to # ISMB2020 organizers for this terrific VIRTUAL conference full of awesome REAL sciences. https://twitter.com/StevenSalzberg1/status/1283907461183873027 …";;;#;"1283925964012101632";https://twitter.com/computbiolgeek/status/1283925964012101632
StevenSalzberg1;2020-07-16 19:32;10;125;"Thanks to # ismb2020 organizers and staff for a terrific, inclusive conference. Sorry we couldn't all meet in Montreal as planned, but I had over 800 attendees at my talk today, many of whom probably couldn't have made it in person.";;;#;"1283907461183873027";https://twitter.com/StevenSalzberg1/status/1283907461183873027
drsbello;2020-07-16 19:08;0;2;"Fair warning to those who started following me during # ISMB2020 today is Thursday also known as # MMMattheMovies (featuring The Muppet Movie tonight) and # CriticalRole day. Join or mute or just revel in the weirdnesspic.twitter.com/VfTQWBnGHz";;;# # #;"1283901261667016716";https://twitter.com/drsbello/status/1283901261667016716
jjjvanderhooft;2020-07-16 18:59;2;12;"Great stuff! Our SmartROI work got awarded at the # CompMS # computational # metabolomics COSI # ismb2020 track - check it out below! https://twitter.com/joe__wandy/status/1283898418126114816 …";;;# # # #;"1283899129421336579";https://twitter.com/jjjvanderhooft/status/1283899129421336579
mpadilla905;2020-07-16 18:57;1;10;"Feeling inspired by the tons of amazing work that has been done across bioinformatics subfields now at the end of # ISMB2020. Thanks to my lab mates at @ AleMedinaRivera lab that made possible my attendance! @ julyreza @ AnaBetty2304 @ luci_rmz";;@ @ @ @;#;"1283898511583522818";https://twitter.com/mpadilla905/status/1283898511583522818
joe__wandy;2020-07-16 18:56;3;11;"Thoroughly enjoyed the # metabolomics talks at virtual # ismb2020 today. Our work on SmartROI with @ Vinny_Davies89, @ jjjvanderhooft, @ ronancdaly and @ sdrogers won the best poster for the # compMS track. Check it out!https://youtu.be/kHPYQicGoHE";;@ @ @ @;# # #;"1283898418126114816";https://twitter.com/joe__wandy/status/1283898418126114816
Victoria_L_A;2020-07-16 18:56;0;1;"Me too! Seems like I'll have another day of # ISMB2020";;;#;"1283898256586678274";https://twitter.com/Victoria_L_A/status/1283898256586678274
nicolabordin;2020-07-16 18:49;0;4;"# ISMB2020 was over for me with an awesome talk by Sean O'Donoghue @ CSIRO @ GarvanInstitute. 12 hours of conference and work for 5 days took quite the energy, so goodnight! Looking forward to see all the friends from @ iscbsc next year! # Bioinformatics";;@ @ @;# #;"1283896570165985280";https://twitter.com/nicolabordin/status/1283896570165985280
AleksandraGruca;2020-07-16 18:46;3;6;"CAMDA 2020 Best Poster Award Dimitri Perrin, Queensland University of Technology, Australia, for his poster on "Metagenomic Geolocation using Read Signatures." Congratulations! @ CAMDA_conf @ iscb @ ISMBinfo # ISMB2020";;@ @ @;#;"1283895830471114758";https://twitter.com/AleksandraGruca/status/1283895830471114758
AleksandraGruca;2020-07-16 18:43;1;1;"CAMDA 2020 Best Presentation Award 3rd prize: Maria Peña-Chilet, CIBERER, Spain, for her presentation on "Mechanistic models of CMap drug perturbation functional profiles." Congratulations! @ CAMDA_conf @ iscb @ ISMBinfo @ xdopazo @ FProgresoysalud # ISMB2020";;@ @ @ @ @;#;"1283894980747186184";https://twitter.com/AleksandraGruca/status/1283894980747186184
AleksandraGruca;2020-07-16 18:40;1;2;"CAMDA 2020 Best Presentation Award 2nd prize: Carlos Loucera, FPS, Spain for presentation "Towards a metagenomics interpretable model for understanding the transition from adenoma to colorectal cancer." @ CAMDA_conf @ iscb @ ISMBinfo @ xdopazo @ FProgresoysalud # ISMB2020";;@ @ @ @ @;#;"1283894255715483649";https://twitter.com/AleksandraGruca/status/1283894255715483649
AleksandraGruca;2020-07-16 18:38;2;2;"CAMDA 2020 Best Presentation Award 1st prize: Cory Gardner, Saint Louis University, USA, for his presentation on "Metagenomic Data Analysis with Probability-Based Reduced Dataset Representation." Congratulations! @ CAMDA_conf @ iscb @ ISMBinfo # ISMB2020";;@ @ @;#;"1283893754856964104";https://twitter.com/AleksandraGruca/status/1283893754856964104
aametwally1;2020-07-16 18:34;4;43;"I'm pleased/humbled to receive the Best Talk Award at # ISMB2020 ( # Knowledge-based # Translational # Medicine track). # ISMB is my favorite # Computational # Biology conference, and I'm so proud of this award. Thanks to my mentor, the visionary @ SnyderShot # ML # timeseries # omicspic.twitter.com/BSeF5nVv5H";;@;# # # # # # # # # #;"1283892865790210049";https://twitter.com/aametwally1/status/1283892865790210049
AleMedinaRivera;2020-07-16 18:30;1;8;"Intense days, can't believe # RegSys2020 y over, and # ISMB2020 is about to finish. @ ISCB_RegSys program was simply amazing! Thanks to all the speakers and attendees, discussion was very enriching and inspiring.https://twitter.com/ISCB_RegSys/status/1283869526938058757 …";;@;# #;"1283891672234024965";https://twitter.com/AleMedinaRivera/status/1283891672234024965
melikedonertas;2020-07-16 18:26;0;22;"Virtual # ISMB2020 is now over. Who would've guessed, running from one zoom call to another is as exhausting as running from one conference room to another one Congrats to all survivors Now it's time to sleep";;;#;"1283890707820875777";https://twitter.com/melikedonertas/status/1283890707820875777
