username,date,retweets,favorites,text,geo,mentions,hashtags,id,;permalink
andremrsantos,2017-08-01 18:14,0,0,"They all seem like great stuff. You probably can start here",,,,"892508854407266304",https://twitter.com/andremrsantos/status/892508854407266304
AnkerOfficial,2020-09-10 06:56,1,7,"With 12 outlets, dual surge protection, and overload protection, you can power as many appliances as you need without having to worry about safety.",,,,"1304010760067059712",https://twitter.com/AnkerOfficial/status/1304010760067059712
mikelove,2017-08-01 17:25,0,2,"If you're stuck (after reading pkg vignette and relevant function man page) post to http://support.bioconductor.org with code example",,,,"892496646176739331",https://twitter.com/mikelove/status/892496646176739331
mikelove,2017-08-01 17:22,2,6,"Also Bioc workflows http://www.bioconductor.org/help/workflows/ e.g. one for DESeq2 RNA-seq analysis http://www.bioconductor.org/help/workflows/rnaseqGene/ …",,,,"892495764534026244",https://twitter.com/mikelove/status/892495764534026244
mikelove,2017-08-01 17:20,1,3,"http://rafalab.github.io/pages/harvardx.html … and https://kasperdanielhansen.github.io/genbioconductor/ …",,,,"892495325012930560",https://twitter.com/mikelove/status/892495325012930560
fellgernon,2017-08-01 15:36,3,7,"There are many new tools in @ Bioconductor for large data like scRNA-seq data, check them out # rstats # JSM2017pic.twitter.com/0gV0bshdXH",,@,# #,"892469009286926338",https://twitter.com/fellgernon/status/892469009286926338
fellgernon,2017-08-01 15:26,0,1,"I forgot Aaron Lun, sorry!pic.twitter.com/WIXJPN7k0Z",,,,"892466607116754945",https://twitter.com/fellgernon/status/892466607116754945
fellgernon,2017-08-01 15:23,1,5,"Peter Hickey @ PeteHaitch starting his # JSM2017 talk. Will cover @ Bioconductor tools like SingleCellExperiment by @ drisso1893pic.twitter.com/XayilHgEMi",,@ @ @,#,"892465797683130368",https://twitter.com/fellgernon/status/892465797683130368
groundwalkergmb,2017-08-01 14:36,0,0,"@ AliciaSchep sometimes visualization is about integrating data from multiple types of assays. e.g ComplexHeatmap @ bioconductor pkg # JSM2017",,@ @,#,"892454103997190145",https://twitter.com/groundwalkergmb/status/892454103997190145
mrshrbrmstr,2017-08-01 14:33,1,2,"@ Bioconductor is good; I'd also get him involved in something "real" https://scistarter.com/citizenscience.html … data collection for Citizen Science initiatives",,@,,"892453207678611456",https://twitter.com/mrshrbrmstr/status/892453207678611456
nsegata,2017-08-01 12:40,0,1,"It seems we should as well congratulate with you for another paper!",,,,"892424839016919041",https://twitter.com/nsegata/status/892424839016919041
s_wuyts,2017-08-01 12:31,0,1,"Congrats!",,,,"892422638659874820",https://twitter.com/s_wuyts/status/892422638659874820
LeviWaldron1,2017-08-01 11:24,0,0,"Yes @ mikelove I was just going to suggest pointing that out in the Q&A!",,@,,"892405781928267776",https://twitter.com/LeviWaldron1/status/892405781928267776
mikelove,2017-08-01 11:16,0,1,"can I point this out in the Q&A :) ?",,,,"892403669433503744",https://twitter.com/mikelove/status/892403669433503744
nsegata,2017-08-01 11:13,1,4,"Here is the preprint http://www.biorxiv.org/content/early/2017/06/21/103085 … Just accepted in Nature Methods as few minutes ago, @ epasolli does not know it yet",,@,,"892402917931720705",https://twitter.com/nsegata/status/892402917931720705
mikelove,2017-08-01 11:12,6,7,"EP 26 curated metagenomic datasets, 5k samples (will be double by end of year) http://www.biorxiv.org/content/early/2017/06/21/103085 … http://bioconductor.org/packages/curatedMetagenomicData … # JSM2017",,,#,"892402677350584320",https://twitter.com/mikelove/status/892402677350584320
mikelove,2017-08-01 11:10,0,2,"EP want to distribute curated metagenomic data, ExperimentHub package developed in collaboration with @ Bioconductor core team # JSM2017",,@,#,"892402212588199936",https://twitter.com/mikelove/status/892402212588199936
andremrsantos,2017-08-01 10:47,0,1,"I found @ Bioconductor a little confusion and I would recommend checkout tidyverse stuff. Also deseq2/edger doc is great.",,@,,"892396269322285058",https://twitter.com/andremrsantos/status/892396269322285058
bhive01,2017-08-01 10:46,0,0,"@ vsbuffalo may have some advice too. His book is a good intro for starters.",,@,,"892396012077105153",https://twitter.com/bhive01/status/892396012077105153
thomasp85,2017-08-01 10:43,0,2,"@ Bioconductor is the obvious place to start",,@,,"892395371955204096",https://twitter.com/thomasp85/status/892395371955204096
jcszamosi,2017-07-31 09:44,0,0,"I had problems in the past where an old version of a pkg on CRAN was superseding a newer version on bioc, but that was years ago.",,,,"892018196924043265",https://twitter.com/jcszamosi/status/892018196924043265
jcszamosi,2017-07-31 09:41,0,0,"Ah, I didn't realize it added the bioc repos. That's fine then.",,,,"892017252039524355",https://twitter.com/jcszamosi/status/892017252039524355
LenovoLegion,2020-09-03 14:26,14,202,"Lenovo Legion x @ PlayApex Now is your chance to rise above the rest. Unmatched performance, purposeful engineering, modern design. Gear up with a machine as savage as you are. Stylish outside. Savage inside.",,@,,"1301587465258577920",https://twitter.com/LenovoLegion/status/1301587465258577920
benbfly,2017-07-31 03:19,0,0,"Are there any publicly available slide decks on # CWL # WDL or @ nextflow ? # bioc2017",,@,# # #,"891921287190380544",https://twitter.com/benbfly/status/891921287190380544
personalubicomp,2017-07-31 00:54,0,0,"The latest The Ubiquitous Computing Weekly! http://paper.li/personalubicomp/1293929685?edition_id=bcc56840-758a-11e7-970d-002590a5ba2d … Thanks to @ robmacredie @ emmarosephd @ susandra # bioc2017",,@ @ @,#,"891884825212313600",https://twitter.com/personalubicomp/status/891884825212313600
AliciaOshlack,2017-07-29 18:48,0,2,"let me know your dates",,,,"891430246318088192",https://twitter.com/AliciaOshlack/status/891430246318088192
PeteHaitch,2017-07-29 09:30,0,1,"Sadly I don't think the timing will work with 1 or 2 other trips planned to Oz in Oct and Dec",,,,"891289865186398208",https://twitter.com/PeteHaitch/status/891289865186398208
AliciaOshlack,2017-07-29 07:48,0,0,"@ Bioconductor are you coming?",,@,,"891264130618806272",https://twitter.com/AliciaOshlack/status/891264130618806272
sydshaffer,2017-07-29 06:44,0,6,"I'll trade you sheep for wheat. Settlers of Catan at # bioc2017?! https://twitter.com/keegankorthauer/status/890183521993666560 …",,,#,"891248003801067525",https://twitter.com/sydshaffer/status/891248003801067525
drisso1893,2017-07-28 21:36,1,16,"I couldn't have said it better! Bioc meetings are my favorites hands down! Great talks, tutorial and interactions! # bioc2017 https://twitter.com/petehaitch/status/891083513109377024 …",,,#,"891110233426276353",https://twitter.com/drisso1893/status/891110233426276353
Bioconductor,2017-07-28 20:35,1,15,"Thank you to all planners, presenters, and attendees for making # bioc2017 awesome! See you next year! Or at bioc-Europe or bioc-Asia",,,#,"891094861314707457",https://twitter.com/Bioconductor/status/891094861314707457
PeteHaitch,2017-07-28 19:50,1,17,"Thanks for another great Bioconductor meeting. Exciting science & tech plus fun hanging out with old friends & making new ones # bioc2017",,,#,"891083513109377024",https://twitter.com/PeteHaitch/status/891083513109377024
davisjmcc,2017-07-28 19:23,4,16,"Huge thanks to # bioc2017 organisers. Another great meeting; old and new friends. Such good people doing fantastic work. A delight all round!",,,#,"891076600460193793",https://twitter.com/davisjmcc/status/891076600460193793
matthewnmccall,2017-07-28 17:35,0,5,"Had a great time at # bioc2017. Next up # JSM2017.",,,# #,"891049619869847552",https://twitter.com/matthewnmccall/status/891049619869847552
mritchieau,2017-07-28 16:56,0,0,"@ fannyperraudeau # bioc2017 https://twitter.com/AedinCulhane/status/890996793533747201 …",,@,#,"891039783413219329",https://twitter.com/mritchieau/status/891039783413219329
mritchieau,2017-07-28 16:48,14,18,"For European # Bioconductor enthusiasts, come to Cambridge, UK 5-6 Dec 2017, https://bioconductor.org/help/course-materials/2017/BioCEurope/ … # bioc2017 # Rstats",,,# # #,"891037588706004993",https://twitter.com/mritchieau/status/891037588706004993
mritchieau,2017-07-28 16:46,10,12,"Want more # Bioconductor? Join us for # BioCAsia, 17th Nov 2017, Adelaide, Australia https://www.abacbs.org/conference-workshops#bioc2017-link … # bioc2017 # Rstats # ABACBS",,,# # #bioc2017 # # #,"891037204788760576",https://twitter.com/mritchieau/status/891037204788760576
AedinCulhane,2017-07-28 15:57,1,0,"@ simoncoetzee Enhancers. SNPs, GWAS, Functional variants.. https://github.com/Simon-Coetzee/Bioc2017/blob/master/vignettes/Bioc2017Workshop.Rmd … # bioc2017",,@,#,"891024946847256576",https://twitter.com/AedinCulhane/status/891024946847256576
drisso1893,2017-07-28 15:50,4,7,"Amazing work by @ M2RUseR @ _schifferl @ LeviWaldron1 on MultiAssayExperiment class https://doi.org/10.1101/144774 http://bioconductor.org/packages/MultiAssayExperiment … # bioc2017",,@ @ @,#,"891023006360797185",https://twitter.com/drisso1893/status/891023006360797185
davisjmcc,2017-07-28 15:42,23,46,"Slides from my talk at # bioc2017 this morning: https://speakerdeck.com/davismcc/using-r-and-bioconductor-to-explore-genetic-effects-on-single-cell-gene-expression …",,,#,"891020971209084928",https://twitter.com/davisjmcc/status/891020971209084928
AedinCulhane,2017-07-28 15:35,1,2,"# Bioc2017 @ bioconductor Tutorial working on Amazon Web Services # cloud # AWShttps://github.com/seandavi/Bioc2017BigDataWorkshopSession …",,@,# # #,"891019300743598080",https://twitter.com/AedinCulhane/status/891019300743598080
AedinCulhane,2017-07-28 15:31,0,2,"# bioc2017 browse, filter rows/cols, get basic stats on remote (cloud) SummarizedExperiment dataset using https://github.com/vjcitn/restfulSE …",,,#,"891018279271243776",https://twitter.com/AedinCulhane/status/891018279271243776
AedinCulhane,2017-07-28 15:29,4,4,"# bioc2017 themes.. browse cols/rows, get basic statistics of data without loading into memory. On disk http://bioconductor.org/packages/release/bioc/vignettes/MultiAssayExperiment/inst/doc/UsingHDF5Array.html …",,,#,"891017817482559488",https://twitter.com/AedinCulhane/status/891017817482559488
AnkerOfficial,2020-09-10 06:56,1,7,"With 12 outlets, dual surge protection, and overload protection, you can power as many appliances as you need without having to worry about safety.",,,,"1304010760067059712",https://twitter.com/AnkerOfficial/status/1304010760067059712
AedinCulhane,2017-07-28 15:27,3,1,"# Bioc2017 Themes...scRNAseq methods should use the SingleCellExperiment class http://bioconductor.org/packages/3.6/bioc/html/SingleCellExperiment.html …",,,#,"891017310240215040",https://twitter.com/AedinCulhane/status/891017310240215040
AedinCulhane,2017-07-28 15:23,3,7,"# bioc2017 themes... Build packages that extend SummarizedExperiment NOT ExpressionSet http://bioconductor.org/packages/release/bioc/html/SummarizedExperiment.html …",,,#,"891016351673978882",https://twitter.com/AedinCulhane/status/891016351673978882
Bioconductor,2017-07-28 14:56,1,3,"Things are winding down now! Last round of workshops starting in 15 min. Make every minute count! # bioc2017",,,#,"891009455638405121",https://twitter.com/Bioconductor/status/891009455638405121
geoffjentry,2017-07-28 14:34,0,0,"Thanks for the pic! It was a lot of fun getting a chance to revisit my # rstats days and talk about @ WDL_dev at # bioc2017 https://twitter.com/xenggg/status/890964576438800384 …",,@,# #,"891003965185380356",https://twitter.com/geoffjentry/status/891003965185380356
AedinCulhane,2017-07-28 14:06,2,12,"@ fperraudeau # Bioc2017 single cell workshop https://github.com/fperraudeau/bioc2017singlecell …pic.twitter.com/v7m8scTFpN",,@,#,"890996793533747201",https://twitter.com/AedinCulhane/status/890996793533747201
RLadiesBuff,2017-07-28 13:47,1,9,"CyTOF workflow workshop! # bioc2017 pic.twitter.com/fNtkaPSMEA",,,#,"890992237219336196",https://twitter.com/RLadiesBuff/status/890992237219336196
AedinCulhane,2017-07-28 13:45,3,3,"Bioconductor workflow for scRNA seq https://f1000research.com/articles/6-1158/v1 … # bioc2017 pic.twitter.com/lerBobJVkr",,,#,"890991558987849732",https://twitter.com/AedinCulhane/status/890991558987849732
MariannaFoos,2017-07-28 13:40,1,1,"Enjoying the EGSEA workshop at # bioc2017, and I spy an R-Lady @ goknurginer in the acknowledgements! # rladiespic.twitter.com/RhaF1tfFq5",,@,# #,"890990351028301824",https://twitter.com/MariannaFoos/status/890990351028301824
lgatt0,2017-07-28 13:38,0,1,"Will soon send more details out",,,,"890989821388369921",https://twitter.com/lgatt0/status/890989821388369921
mritchieau,2017-07-28 12:45,9,7,"Notes from Sonali Arora's birds of a feather session on tools for accessing TCGA & GTEx data available at https://github.com/sonali-bioc/BioC2017_TCGA_GTEx_BOF … # bioc2017",,,#,"890976443047587840",https://twitter.com/mritchieau/status/890976443047587840
csgillespie,2017-07-28 12:43,1,6,"Just added it tohttps://jumpingrivers.github.io/meetingsR/events.html …",,,,"890976111131320321",https://twitter.com/csgillespie/status/890976111131320321
lopantano,2017-07-28 12:07,4,3,"all speakers talks summary # bioc2017 # morning # day2https://www.evernote.com/l/ACiJ3U6woAtKMZa8l1WFNRkFXoJtjKLlu7U …",,,# # #,"890967037610262531",https://twitter.com/lopantano/status/890967037610262531
robertclab,2017-07-28 12:07,0,0,"J. Gentry: Integration with R through the wdlRunR package https://github.com/seandavis/wdlRunR … # bioc2017",,,#,"890966975433895941",https://twitter.com/robertclab/status/890966975433895941
robertclab,2017-07-28 12:04,1,0,"J. Gentry: hello world example java -jar cromwell.jar run hello.wdl hello_inputs.json # bioc2017",,,#,"890966143086866432",https://twitter.com/robertclab/status/890966143086866432
vigocarpathian,2017-07-28 11:59,3,4,"Our group has been focused on CWL, we should consider this as a practical alternative @center4bfg # bioc2017 @ simoncoetzeepic.twitter.com/rvCPyu64un",,@center4bfg @,#,"890965036688179204",https://twitter.com/vigocarpathian/status/890965036688179204
xenggg,2017-07-28 11:58,4,2,"Talk #6: Gentry presents Cromwell and WDL for readable, scalable workflows! Gotta find time to try this instead of snakemake! # bioc2017 pic.twitter.com/SM3KRENBkm",,,#6 #,"890964576438800384",https://twitter.com/xenggg/status/890964576438800384
robertclab,2017-07-28 11:57,0,0,"J. Gentry: Cromwell an execution engine that can run on any platform https://github.com/broadinstitute/cromwell … # bioc2017",,,#,"890964524853063684",https://twitter.com/robertclab/status/890964524853063684
robertclab,2017-07-28 11:54,0,0,"J. Gentry: WDL a workflow language that humans can read https://software.broadinstitute.org/wdl # bioc2017",,,#,"890963796117815296",https://twitter.com/robertclab/status/890963796117815296
robertclab,2017-07-28 11:51,0,0,"Jeff Gentry on Cromwell and WDL, bioinformatics pipelines at any scale # bioc2017",,,#,"890962862268706816",https://twitter.com/robertclab/status/890962862268706816
xenggg,2017-07-28 11:49,1,0,"Talk #5: @ keegankorthauer presents dmrseq w/ to control high FDR in differential methylation studies! # bioc2017 pic.twitter.com/i7ASavCiCh",,@,#5 #,"890962519363379201",https://twitter.com/xenggg/status/890962519363379201
LenovoLegion,2020-09-03 14:26,14,202,"Lenovo Legion x @ PlayApex Now is your chance to rise above the rest. Unmatched performance, purposeful engineering, modern design. Gear up with a machine as savage as you are. Stylish outside. Savage inside.",,@,,"1301587465258577920",https://twitter.com/LenovoLegion/status/1301587465258577920
robertclab,2017-07-28 11:47,1,0,"K. Korthauer: dmrseq controls correctly FDR (nice QQ plot) and identified DMRs are enriched for DE genes # bioc2017",,,#,"890961996736233472",https://twitter.com/robertclab/status/890961996736233472
drisso1893,2017-07-28 11:47,10,7,"dmrseq # rstats pkg: exchangeable region-level summary scores + permutations to control FDR https://github.com/kdkorthauer/dmrseq … # bioc2017",,,# #,"890961938888499200",https://twitter.com/drisso1893/status/890961938888499200
vigocarpathian,2017-07-28 11:47,0,0,"@ benbfly @center4bfg these guys have a dmr analysis approach # bioc2017 have u seen this b4? pic.twitter.com/El5wLkPA7r",,@ @center4bfg,#,"890961850283827201",https://twitter.com/vigocarpathian/status/890961850283827201
RLadiesBuff,2017-07-28 11:45,0,0,"@ keegankorthauer on differential methylation analysis. dmrseq # bioc2017",,@,#,"890961357239201792",https://twitter.com/RLadiesBuff/status/890961357239201792
robertclab,2017-07-28 11:42,1,1,"K. Korthauer: dmrseq, detect regions by scanning the genome for candidate regions. Region-levrl summary scored compared to a null # bioc2017",,,#,"890960762965045248",https://twitter.com/robertclab/status/890960762965045248
robertclab,2017-07-28 11:40,0,0,"K. Korthauer: controlling FDR at loci level is not the same as controlling it at region level # bioc2017",,,#,"890960152416964608",https://twitter.com/robertclab/status/890960152416964608
drisso1893,2017-07-28 11:40,1,1,". @ keegankorthauer on differential methylation analysis: controlling FDR at the region level is not same as at individual CpG # bioc2017",,@,#,"890960047643254784",https://twitter.com/drisso1893/status/890960047643254784
robertclab,2017-07-28 11:35,1,0,"Keegan Korthauer on detection and inference of diff. methylation from WGBS data # bioc2017",,,#,"890958981560139778",https://twitter.com/robertclab/status/890958981560139778
mritchieau,2017-07-28 11:31,2,0,"COMPASS software available from https://bioconductor.org/packages/release/bioc/html/COMPASS.html … # bioc2017 https://twitter.com/xenggg/status/890957592515805184 …",,,#,"890957988017696769",https://twitter.com/mritchieau/status/890957988017696769
xenggg,2017-07-28 11:30,0,2,"Talk #4: @ raphg uses flow cytometry and statistics w/ COMPASS to show how more polyfunctional t-cells decrease HIV infection! # bioc2017 pic.twitter.com/zEXMqovWdM",,@,#4 #,"890957592515805184",https://twitter.com/xenggg/status/890957592515805184
vigocarpathian,2017-07-28 11:23,1,0,"Yet another talk using bayesian stats via MCMC, this time for cytometry @center4bfg # bioc2017 classical stats are simply not up to the task pic.twitter.com/8XUbWjHXKO",,@center4bfg,#,"890955860838686720",https://twitter.com/vigocarpathian/status/890955860838686720
drisso1893,2017-07-28 11:21,1,1,". @ raphg uses on disk representation of flow cytometry data with # hdf5 for big clinical trial data. Much to learn from for scRNA # bioc2017",,@,# #,"890955337217576960",https://twitter.com/drisso1893/status/890955337217576960
robertclab,2017-07-28 11:18,1,1,"R. Gottardo on analysis tools for flow cytometry analysis and standardization in Bioconductor # bioc2017",,,#,"890954499204026369",https://twitter.com/robertclab/status/890954499204026369
mritchieau,2017-07-28 11:12,2,6,"Hear, hear! A great community # bioc2017 https://twitter.com/drisso1893/status/890952211227955200 …",,,#,"890953185078149120",https://twitter.com/mritchieau/status/890953185078149120
drisso1893,2017-07-28 11:08,3,5,"# bioc2017 shoutout to # rstats developers by @ davisjmccpic.twitter.com/P4lqnGUzX4",,@,# #,"890952211227955200",https://twitter.com/drisso1893/status/890952211227955200
robertclab,2017-07-28 11:08,1,0,"Raphael Gottardo on flow cytometry, in some applications, it's better than single-cell genomics # bioc2017",,,#,"890952118458355712",https://twitter.com/robertclab/status/890952118458355712
mritchieau,2017-07-28 11:08,1,2,"@ raphg speaking about # oldschool # singelcell technology in flow cytometry - a mainstay of immunology research # bioc2017",,@,# # #,"890952084891291648",https://twitter.com/mritchieau/status/890952084891291648
F1000Research,2017-07-28 11:07,1,3,"Article from our Bioconductor gateway about pipeline for differential analyses of HDCyto data # bioc2017 https://f1000research.com/articles/6-748/v1 …pic.twitter.com/XJqS12EFc0",,,#,"890951737581981696",https://twitter.com/F1000Research/status/890951737581981696
dccc_phd,2017-07-28 11:05,3,2,"Forget BioC stickers, @ davisjmcc tempts # bioc2017 audience with two 'scater' pkg T-shirts!",,@,#,"890951460384649217",https://twitter.com/dccc_phd/status/890951460384649217
mritchieau,2017-07-28 11:04,0,3,"And free scater t-shirts on offer! @ rafalab has his sights set on one # bioc2017 https://twitter.com/robertclab/status/890950566867808257 …",,@,#,"890951051687473153",https://twitter.com/mritchieau/status/890951051687473153
LenovoLegion,2020-09-03 14:26,14,202,"Lenovo Legion x @ PlayApex Now is your chance to rise above the rest. Unmatched performance, purposeful engineering, modern design. Gear up with a machine as savage as you are. Stylish outside. Savage inside.",,@,,"1301587465258577920",https://twitter.com/LenovoLegion/status/1301587465258577920
robertclab,2017-07-28 11:02,1,2,"Davis McCarthy slides at http://bit.ly/McCarthyBioc2017 … # bioc2017",,,#,"890950566867808257",https://twitter.com/robertclab/status/890950566867808257
robertclab,2017-07-28 10:58,1,1,"Davis McCarthy now on scaling R/Bioconductor tools to scRNA-seq data on millions of cells # bioc2017",,,#,"890949693609578496",https://twitter.com/robertclab/status/890949693609578496
groundwalkergmb,2017-07-28 10:58,0,0,"You can trivially have metadata about columns in the DataFrame class there, though it isn't currently tidyverse compat",,,,"890949559198797828",https://twitter.com/groundwalkergmb/status/890949559198797828
groundwalkergmb,2017-07-28 10:57,0,0,"btw, @ bioconductor has the concepts of metadata/annotations build deeply into it's bones",,@,,"890949307578200064",https://twitter.com/groundwalkergmb/status/890949307578200064
xenggg,2017-07-28 10:51,0,0,"Talk #3: McCarthy uses single cell QTL data to call variants by pooling donor cells! # bioc2017 pic.twitter.com/lWMsziTpR9",,,#3 #,"890947832957501440",https://twitter.com/xenggg/status/890947832957501440
areyesq,2017-07-28 10:50,1,3,". @ davisjmcc calling genetic variants using scRNA-seq (with enough sequencing depth) to trace back donors. # bioc2017",,@,#,"890947622424518656",https://twitter.com/areyesq/status/890947622424518656
PeteHaitch,2017-07-28 10:50,1,9,"@ davisjmcc presenting HipSci at # bioc2017 . (May or may not actually stand for hipster science) pic.twitter.com/3PNQBYldZV",,@,#,"890947501989277696",https://twitter.com/PeteHaitch/status/890947501989277696
robertclab,2017-07-28 10:47,1,1,"Davis McCarthy scRNA-seq challenges in the context of the human induced pluripotent stem cell initiative http://www.hipsci.org # bioc2017",,,#,"890946899037085698",https://twitter.com/robertclab/status/890946899037085698
drisso1893,2017-07-28 10:47,0,1,"Approach: pool donors and computationally re-identify cells' donor ID by estimating "genomic relatedness" # bioc2017",,,#,"890946828086239232",https://twitter.com/drisso1893/status/890946828086239232
drisso1893,2017-07-28 10:45,1,2,". @ davisjmcc Goal is to design single-cell eQTL study with enough power and not affected by batch effect # bioc2017",,@,#,"890946380432277506",https://twitter.com/drisso1893/status/890946380432277506
drisso1893,2017-07-28 10:42,0,1,"I think it's fair to say that Aaron was the real star of # bioc2017 :D",,,#,"890945587117535233",https://twitter.com/drisso1893/status/890945587117535233
mritchieau,2017-07-28 10:40,3,4,"@ davisjmcc giving us an overview of eQTL analysis # bioc2017 pic.twitter.com/lWq2BEi1bK",,@,#,"890945027802898432",https://twitter.com/mritchieau/status/890945027802898432
robertclab,2017-07-28 10:35,0,0,"Davis McCarthy on single-cell QTL mapping # bioc2017",,,#,"890943850713370624",https://twitter.com/robertclab/status/890943850713370624
F1000Research,2017-07-28 10:03,8,8,"Article about Bioconductor workflow for single-cell RNA sequencing that could be of interest to those at # bioc2017 https://f1000research.com/articles/6-1158/v1 …pic.twitter.com/uXLP2ZkvzY",,,#,"890935633706987520",https://twitter.com/F1000Research/status/890935633706987520
davisjmcc,2017-07-28 09:56,0,8,"Live code review from Aaron Lun, "not so much a question, more of a comment", was a real # bioc2017 highlight https://twitter.com/davisjmcc/status/890933714288553988 …",,,#,"890934052622094340",https://twitter.com/davisjmcc/status/890934052622094340
davisjmcc,2017-07-28 09:55,0,1,"Tough questions for Martin Aryee. This is what happens when you allow to many Australians at your conference, # bioc2017",,,#,"890933714288553988",https://twitter.com/davisjmcc/status/890933714288553988
MariannaFoos,2017-07-28 09:52,3,15,"Audience question: "So, I'm looking at your R code right now..." # bioc2017",,,#,"890933053014634496",https://twitter.com/MariannaFoos/status/890933053014634496
mritchieau,2017-07-28 09:44,0,1,"Aryee Lab pkgs for studying 3D structure of genome inc. diffloop https://bioconductor.org/packages/release/bioc/html/diffloop.html … & DNALansdcaper http://dnalandscaper.aryeelab.org # bioc2017",,,#,"890930889059966977",https://twitter.com/mritchieau/status/890930889059966977
drisso1893,2017-07-28 09:43,0,3,"Martin Aryee: # Bioconductor package for differential topology analysis for ChIA-PET data http://bioconductor.org/packages/diffloop … # bioc2017",,,# #,"890930661602840576",https://twitter.com/drisso1893/status/890930661602840576
areyesq,2017-07-28 09:39,1,2,"# bioc2017 https://twitter.com/areyesq/status/890929494168678404 …",,,#,"890929792631144448",https://twitter.com/areyesq/status/890929792631144448
